PopID,sample,sampleID,station,Niskin,depth,drop.sample,field.negative.type,volume,Fluor,Zymo,date,year,month,day,transect,lat,lon,water.depth,bathy.bottom.depth,bottom.depth.consensus,utm.lon,utm.lat,transect.dist.km,control
52193,1,52193-1,22-2,1,50,,NA,2.5,0.10337,,7/2/2019,2019,7,2,22,37.89499,-123.171755,95.58,94,95.58,949.598947,819.8134471,28.40638222,no
52193,2,52193-2,22-2,2,50,,NA,2.5,0.10337,,7/2/2019,2019,7,2,22,37.89499,-123.171755,95.58,94,95.58,949.598947,819.8134471,28.40638222,no
52193,3,52193-3,22-2,3,25,,NA,2.5,3.08112,,7/2/2019,2019,7,2,22,37.89499,-123.171755,95.58,94,95.58,949.598947,819.8134471,28.40638222,no
52193,4,52193-4,22-2,4,25,,NA,2.5,3.08112,,7/2/2019,2019,7,2,22,37.89499,-123.171755,95.58,94,95.58,949.598947,819.8134471,28.40638222,no
52193,5,52193-5,22-2,sfc,0,,NA,2.5,7.01868,Yes,7/2/2019,2019,7,2,22,37.89499,-123.171755,95.58,94,95.58,949.598947,819.8134471,28.40638222,no
52193,6,52193-6,22-2,sfc,0,,NA,2.5,7.01868,Yes,7/2/2019,2019,7,2,22,37.89499,-123.171755,95.58,94,95.58,949.598947,819.8134471,28.40638222,no
52193,7,52193-7,22-1,1,48,,NA,2.5,0.13185,,7/2/2019,2019,7,2,22,37.89730667,-122.8637667,53.28,55,53.28,976.7491259,819.9645459,1.633882057,no
52193,8,52193-8,22-1,2,48,,NA,2.5,0.13185,,7/2/2019,2019,7,2,22,37.89730667,-122.8637667,53.28,55,53.28,976.7491259,819.9645459,1.633882057,no
52193,9,52193-9,22-1,3,25,,NA,2.5,0.52725,,7/2/2019,2019,7,2,22,37.89730667,-122.8637667,53.28,55,53.28,976.7491259,819.9645459,1.633882057,no
52193,10,52193-10,22-1,4,25,,NA,2.5,0.52725,,7/2/2019,2019,7,2,22,37.89730667,-122.8637667,53.28,55,53.28,976.7491259,819.9645459,1.633882057,no
52193,11,52193-11,22-1,sfc,0,,NA,2.5,2.7495,Yes,7/2/2019,2019,7,2,22,37.89730667,-122.8637667,53.28,55,53.28,976.7491259,819.9645459,1.633882057,no
52193,12,52193-12,22-1,sfc,0,,NA,2.5,2.7495,Yes,7/2/2019,2019,7,2,22,37.89730667,-122.8637667,53.28,55,53.28,976.7491259,819.9645459,1.633882057,no
52193,13,52193-13,23-1,1,45,,NA,2.5,,,7/3/2019,2019,7,3,23,38.06400667,-123.0163683,50.84,58,50.84,963.3768159,838.4682855,0.488571064,no
52193,14,52193-14,23-1,2,45,,NA,2.5,,,7/3/2019,2019,7,3,23,38.06400667,-123.0163683,50.84,58,50.84,963.3768159,838.4682855,0.488571064,no
52193,15,52193-15,23-1,3,25,,NA,2.5,,Yes,7/3/2019,2019,7,3,23,38.06400667,-123.0163683,50.84,58,50.84,963.3768159,838.4682855,0.488571064,no
52193,16,52193-16,23-1,4,25,,NA,2,,Yes,7/3/2019,2019,7,3,23,38.06400667,-123.0163683,50.84,58,50.84,963.3768159,838.4682855,0.488571064,no
52193,17,52193-17,23-1,sfc,0,,NA,2.5,,Yes,7/3/2019,2019,7,3,23,38.06400667,-123.0163683,50.84,58,50.84,963.3768159,838.4682855,0.488571064,no
52193,18,52193-18,23-1,sfc,0,,NA,2.5,,Yes,7/3/2019,2019,7,3,23,38.06400667,-123.0163683,50.84,58,50.84,963.3768159,838.4682855,0.488571064,no
52193,21,52193-21,25-6,1,500,,NA,2.5,NaN,,7/3/2019,2019,7,3,25,38.39640667,-123.7726167,1493.84,1560,1493.84,897.3089773,875.7670523,55.13189265,no
52193,22,52193-22,25-6,2,500,,NA,2.5,NaN,,7/3/2019,2019,7,3,25,38.39640667,-123.7726167,1493.84,1560,1493.84,897.3089773,875.7670523,55.13189265,no
52193,23,52193-23,25-6,3,300,,NA,2.5,0.00628,,7/3/2019,2019,7,3,25,38.39640667,-123.7726167,1493.84,1560,1493.84,897.3089773,875.7670523,55.13189265,no
52193,24,52193-24,25-6,4,300,,NA,2.5,0.00628,,7/3/2019,2019,7,3,25,38.39640667,-123.7726167,1493.84,1560,1493.84,897.3089773,875.7670523,55.13189265,no
52193,25,52193-25,25-6,6,150,,NA,2.5,-0.0011,,7/3/2019,2019,7,3,25,38.39640667,-123.7726167,1493.84,1560,1493.84,897.3089773,875.7670523,55.13189265,no
52193,26,52193-26,25-6,7,100,,NA,2.5,0.00911,,7/3/2019,2019,7,3,25,38.39640667,-123.7726167,1493.84,1560,1493.84,897.3089773,875.7670523,55.13189265,no
52193,27,52193-27,25-6,8,100,,NA,2.5,0.00911,,7/3/2019,2019,7,3,25,38.39640667,-123.7726167,1493.84,1560,1493.84,897.3089773,875.7670523,55.13189265,no
52193,28,52193-28,25-6,9,50,,NA,2.5,0.4395,,7/3/2019,2019,7,3,25,38.39640667,-123.7726167,1493.84,1560,1493.84,897.3089773,875.7670523,55.13189265,no
52193,29,52193-29,25-6,10,50,,NA,2.5,0.4395,Yes,7/3/2019,2019,7,3,25,38.39640667,-123.7726167,1493.84,1560,1493.84,897.3089773,875.7670523,55.13189265,no
52193,30,52193-30,25-6,sfc,0,,NA,2.5,1.24222,,7/3/2019,2019,7,3,25,38.39640667,-123.7726167,1493.84,1560,1493.84,897.3089773,875.7670523,55.13189265,no
52193,31,52193-31,25-6,sfc,0,,NA,2.5,1.24222,Yes,7/3/2019,2019,7,3,25,38.39640667,-123.7726167,1493.84,1560,1493.84,897.3089773,875.7670523,55.13189265,no
52193,32,52193-32,25-4,1,495,,NA,2.5,0.01474,,7/3/2019,2019,7,3,25,38.39212,-123.6252383,506.13,566,506.13,910.209738,875.1600561,42.2627701,no
52193,33,52193-33,25-4,2,495,,NA,2.5,0.01474,,7/3/2019,2019,7,3,25,38.39212,-123.6252383,506.13,566,506.13,910.209738,875.1600561,42.2627701,no
52193,34,52193-34,25-4,3,300,,NA,2.5,0.00131,,7/3/2019,2019,7,3,25,38.39212,-123.6252383,506.13,566,506.13,910.209738,875.1600561,42.2627701,no
52193,35,52193-35,25-4,4,300,,NA,2.5,0.00131,,7/3/2019,2019,7,3,25,38.39212,-123.6252383,506.13,566,506.13,910.209738,875.1600561,42.2627701,no
52193,36,52193-36,25-4,5,150,,NA,2.5,-0.0056,,7/3/2019,2019,7,3,25,38.39212,-123.6252383,506.13,566,506.13,910.209738,875.1600561,42.2627701,no
52193,37,52193-37,25-4,6,150,,NA,2.5,-0.0056,,7/3/2019,2019,7,3,25,38.39212,-123.6252383,506.13,566,506.13,910.209738,875.1600561,42.2627701,no
52193,38,52193-38,25-4,7,100,,NA,2.5,0.0053,,7/3/2019,2019,7,3,25,38.39212,-123.6252383,506.13,566,506.13,910.209738,875.1600561,42.2627701,no
52193,39,52193-39,25-4,8,100,,NA,2.5,0.0053,,7/3/2019,2019,7,3,25,38.39212,-123.6252383,506.13,566,506.13,910.209738,875.1600561,42.2627701,no
52193,40,52193-40,25-4,9,50,,NA,2.5,0.33992,,7/3/2019,2019,7,3,25,38.39212,-123.6252383,506.13,566,506.13,910.209738,875.1600561,42.2627701,no
52193,41,52193-41,25-4,10,50,,NA,2.5,0.33992,,7/3/2019,2019,7,3,25,38.39212,-123.6252383,506.13,566,506.13,910.209738,875.1600561,42.2627701,no
52193,42,52193-42,25-4,sfc,0,,NA,2.5,1.924,,7/3/2019,2019,7,3,25,38.39212,-123.6252383,506.13,566,506.13,910.209738,875.1600561,42.2627701,no
52193,43,52193-43,25-4,sfc,0,,NA,2.5,1.924,,7/3/2019,2019,7,3,25,38.39212,-123.6252383,506.13,566,506.13,910.209738,875.1600561,42.2627701,no
52193,44,52193-44,25-2,1,135,,NA,2.5,0.01659,,7/4/2019,2019,7,4,25,38.39422833,-123.4501533,147.97,169,147.97,925.5451204,875.2593192,26.96530502,no
52193,45,52193-45,25-2,2,135,,NA,2.5,0.01659,,7/4/2019,2019,7,4,25,38.39422833,-123.4501533,147.97,169,147.97,925.5451204,875.2593192,26.96530502,no
52193,46,52193-46,25-2,3,100,Y,NA,2.5,0.00265,,7/4/2019,2019,7,4,25,38.39422833,-123.4501533,147.97,169,147.97,925.5451204,875.2593192,26.96530502,no
52193,47,52193-47,25-2,4,100,,NA,2.5,0.00265,,7/4/2019,2019,7,4,25,38.39422833,-123.4501533,147.97,169,147.97,925.5451204,875.2593192,26.96530502,no
52193,48,52193-48,25-2,5,50,,NA,2.5,4.37044,,7/4/2019,2019,7,4,25,38.39422833,-123.4501533,147.97,169,147.97,925.5451204,875.2593192,26.96530502,no
52193,49,52193-49,25-2,6,50,,NA,2.5,4.37044,,7/4/2019,2019,7,4,25,38.39422833,-123.4501533,147.97,169,147.97,925.5451204,875.2593192,26.96530502,no
52193,50,52193-50,25-2,sfc,0,,NA,2.5,8.98138,,7/4/2019,2019,7,4,25,38.39422833,-123.4501533,147.97,169,147.97,925.5451204,875.2593192,26.96530502,no
52193,51,52193-51,25-2,sfc,0,,NA,2.5,8.98138,,7/4/2019,2019,7,4,25,38.39422833,-123.4501533,147.97,169,147.97,925.5451204,875.2593192,26.96530502,no
52193,52,52193-52,25-1,1,40,,NA,2.5,0.25387,,7/4/2019,2019,7,4,25,38.39622167,-123.1414683,48.43,57,48.43,952.5799272,875.3044904,0.141938461,no
52193,53,52193-53,25-1,2,40,,NA,2.5,0.25387,,7/4/2019,2019,7,4,25,38.39622167,-123.1414683,48.43,57,48.43,952.5799272,875.3044904,0.141938461,no
52193,54,52193-54,25-1,3,25,,NA,2.5,0.31925,,7/4/2019,2019,7,4,25,38.39622167,-123.1414683,48.43,57,48.43,952.5799272,875.3044904,0.141938461,no
52193,55,52193-55,25-1,4,25,,NA,2.5,0.31925,,7/4/2019,2019,7,4,25,38.39622167,-123.1414683,48.43,57,48.43,952.5799272,875.3044904,0.141938461,no
52193,56,52193-56,25-1,sfc,0,,NA,2.5,0.34069,,7/4/2019,2019,7,4,25,38.39622167,-123.1414683,48.43,57,48.43,952.5799272,875.3044904,0.141938461,no
52193,57,52193-57,25-1,sfc,0,,NA,2,0.34069,,7/4/2019,2019,7,4,25,38.39622167,-123.1414683,48.43,57,48.43,952.5799272,875.3044904,0.141938461,no
52193,58,52193-58,26-1,1,50,,NA,2.5,0.34337,Yes,7/4/2019,2019,7,4,26,38.56360833,-123.3499667,67.37,75,67.37,934.4655957,893.947564,0.311007732,no
52193,59,52193-59,26-1,2,50,,NA,2.5,0.34337,Yes,7/4/2019,2019,7,4,26,38.56360833,-123.3499667,67.37,75,67.37,934.4655957,893.947564,0.311007732,no
52193,60,52193-60,26-1,3,25,,NA,2.5,0.20755,,7/4/2019,2019,7,4,26,38.56360833,-123.3499667,67.37,75,67.37,934.4655957,893.947564,0.311007732,no
52193,61,52193-61,26-1,4,25,,NA,2.5,0.20755,,7/4/2019,2019,7,4,26,38.56360833,-123.3499667,67.37,75,67.37,934.4655957,893.947564,0.311007732,no
52193,62,52193-62,26-1,sfc,0,,NA,2.5,0.31961,,7/4/2019,2019,7,4,26,38.56360833,-123.3499667,67.37,75,67.37,934.4655957,893.947564,0.311007732,no
52193,63,52193-63,26-1,sfc,0,,NA,2.5,0.31961,,7/4/2019,2019,7,4,26,38.56360833,-123.3499667,67.37,75,67.37,934.4655957,893.947564,0.311007732,no
52193,64,52193-64,26-2,1,150,,NA,2.5,0.00581,,7/4/2019,2019,7,4,26,38.56174167,-123.6588383,219.43,246,219.43,907.474439,893.9689623,26.73533469,no
52193,65,52193-65,26-2,2,150,,NA,2.5,0.00581,,7/4/2019,2019,7,4,26,38.56174167,-123.6588383,219.43,246,219.43,907.474439,893.9689623,26.73533469,no
52193,66,52193-66,26-2,3,100,,NA,2.5,-0.0047,,7/4/2019,2019,7,4,26,38.56174167,-123.6588383,219.43,246,219.43,907.474439,893.9689623,26.73533469,no
52193,67,52193-67,26-2,4,100,,NA,2.5,-0.0047,,7/4/2019,2019,7,4,26,38.56174167,-123.6588383,219.43,246,219.43,907.474439,893.9689623,26.73533469,no
52193,68,52193-68,26-2,5,50,,NA,2.5,0.04593,,7/4/2019,2019,7,4,26,38.56174167,-123.6588383,219.43,246,219.43,907.474439,893.9689623,26.73533469,no
52193,69,52193-69,26-2,6,50,,NA,2.5,0.04593,,7/4/2019,2019,7,4,26,38.56174167,-123.6588383,219.43,246,219.43,907.474439,893.9689623,26.73533469,no
52193,70,52193-70,26-2,sfc,0,,NA,2.5,2.1658,,7/4/2019,2019,7,4,26,38.56174167,-123.6588383,219.43,246,219.43,907.474439,893.9689623,26.73533469,no
52193,71,52193-71,26-2,sfc,0,,NA,2.5,2.1658,,7/4/2019,2019,7,4,26,38.56174167,-123.6588383,219.43,246,219.43,907.474439,893.9689623,26.73533469,no
52193,72,52193-72,26-3,1,500,,NA,2.5,0.01035,,7/4/2019,2019,7,4,26,38.56264167,-123.9785983,-0.02,2390,2390,879.5362947,894.3867684,54.601119,no
52193,73,52193-73,26-3,2,500,,NA,2.5,0.01035,,7/4/2019,2019,7,4,26,38.56264167,-123.9785983,-0.02,2390,2390,879.5362947,894.3867684,54.601119,no
52193,74,52193-74,26-3,3,300,,NA,2.5,0.00583,,7/4/2019,2019,7,4,26,38.56264167,-123.9785983,-0.02,2390,2390,879.5362947,894.3867684,54.601119,no
52193,75,52193-75,26-3,4,300,,NA,2.5,0.00583,,7/4/2019,2019,7,4,26,38.56264167,-123.9785983,-0.02,2390,2390,879.5362947,894.3867684,54.601119,no
52193,76,52193-76,26-3,5,150,,NA,2.5,#######,,7/4/2019,2019,7,4,26,38.56264167,-123.9785983,-0.02,2390,2390,879.5362947,894.3867684,54.601119,no
52193,77,52193-77,26-3,6,150,,NA,2.5,#######,,7/4/2019,2019,7,4,26,38.56264167,-123.9785983,-0.02,2390,2390,879.5362947,894.3867684,54.601119,no
52193,78,52193-78,26-3,7,100,,NA,2.5,0.00237,,7/4/2019,2019,7,4,26,38.56264167,-123.9785983,-0.02,2390,2390,879.5362947,894.3867684,54.601119,no
52193,79,52193-79,26-3,8,100,,NA,2.5,0.00237,,7/4/2019,2019,7,4,26,38.56264167,-123.9785983,-0.02,2390,2390,879.5362947,894.3867684,54.601119,no
52193,80,52193-80,26-3,9,50,,NA,2.5,0.07922,,7/4/2019,2019,7,4,26,38.56264167,-123.9785983,-0.02,2390,2390,879.5362947,894.3867684,54.601119,no
52193,81,52193-81,26-3,10,50,,NA,2.5,0.07922,,7/4/2019,2019,7,4,26,38.56264167,-123.9785983,-0.02,2390,2390,879.5362947,894.3867684,54.601119,no
52193,82,52193-82,26-3,sfc,0,,NA,2.5,2.56342,Yes,7/4/2019,2019,7,4,26,38.56264167,-123.9785983,-0.02,2390,2390,879.5362947,894.3867684,54.601119,no
52193,83,52193-83,26-3,sfc,0,,NA,2.5,2.56342,Yes,7/4/2019,2019,7,4,26,38.56264167,-123.9785983,-0.02,2390,2390,879.5362947,894.3867684,54.601119,no
52193,84,52193-84,27-8,1,500,,NA,2.5,0.01193,,7/5/2019,2019,7,5,27,38.72578,-124.28769,-0.02,3296,3296,852.8496095,912.8340158,65.80136915,no
52193,85,52193-85,27-8,2,500,,NA,2.5,0.01193,,7/5/2019,2019,7,5,27,38.72578,-124.28769,-0.02,3296,3296,852.8496095,912.8340158,65.80136915,no
52193,86,52193-86,27-8,3,300,,NA,2.5,0.01039,,7/5/2019,2019,7,5,27,38.72578,-124.28769,-0.02,3296,3296,852.8496095,912.8340158,65.80136915,no
52193,87,52193-87,27-8,4,300,,NA,2.5,0.01039,,7/5/2019,2019,7,5,27,38.72578,-124.28769,-0.02,3296,3296,852.8496095,912.8340158,65.80136915,no
52193,88,52193-88,27-8,5,150,,NA,2.5,0.00374,,7/5/2019,2019,7,5,27,38.72578,-124.28769,-0.02,3296,3296,852.8496095,912.8340158,65.80136915,no
52193,89,52193-89,27-8,6,150,,NA,2.5,0.00374,,7/5/2019,2019,7,5,27,38.72578,-124.28769,-0.02,3296,3296,852.8496095,912.8340158,65.80136915,no
52193,90,52193-90,27-8,7,100,,NA,2.5,0.00685,,7/5/2019,2019,7,5,27,38.72578,-124.28769,-0.02,3296,3296,852.8496095,912.8340158,65.80136915,no
52193,91,52193-91,27-8,8,100,,NA,2.5,0.00685,,7/5/2019,2019,7,5,27,38.72578,-124.28769,-0.02,3296,3296,852.8496095,912.8340158,65.80136915,no
52193,92,52193-92,27-8,9,50,,NA,2.5,4.83516,Yes,7/5/2019,2019,7,5,27,38.72578,-124.28769,-0.02,3296,3296,852.8496095,912.8340158,65.80136915,no
52193,93,52193-93,27-8,10,50,,NA,2.5,4.83516,Yes,7/5/2019,2019,7,5,27,38.72578,-124.28769,-0.02,3296,3296,852.8496095,912.8340158,65.80136915,no
52193,94,52193-94,27-8,sfc,0,,NA,2.5,1.67275,Yes,7/5/2019,2019,7,5,27,38.72578,-124.28769,-0.02,3296,3296,852.8496095,912.8340158,65.80136915,no
52193,95,52193-95,27-6,1,500,,NA,2.5,0.01059,,7/5/2019,2019,7,5,27,38.73053833,-124.073795,497.79,2359,2359,871.5051626,913.0850094,47.1980592,no
52193,96,52193-96,27-6,2,500,,NA,2.5,0.01059,,7/5/2019,2019,7,5,27,38.73053833,-124.073795,497.79,2359,2359,871.5051626,913.0850094,47.1980592,no
52193,97,52193-97,27-6,3,300,,NA,2.5,0.00858,,7/5/2019,2019,7,5,27,38.73053833,-124.073795,497.79,2359,2359,871.5051626,913.0850094,47.1980592,no
52193,98,52193-98,27-6,4,300,,NA,2.5,0.00858,,7/5/2019,2019,7,5,27,38.73053833,-124.073795,497.79,2359,2359,871.5051626,913.0850094,47.1980592,no
52193,99,52193-99,27-6,5,150,,NA,2.5,0.00767,,7/5/2019,2019,7,5,27,38.73053833,-124.073795,497.79,2359,2359,871.5051626,913.0850094,47.1980592,no
52193,100,52193-100,27-6,6,150,,NA,2.5,0.00767,,7/5/2019,2019,7,5,27,38.73053833,-124.073795,497.79,2359,2359,871.5051626,913.0850094,47.1980592,no
52193,101,52193-101,27-6,7,100,,NA,2.5,0.02036,,7/5/2019,2019,7,5,27,38.73053833,-124.073795,497.79,2359,2359,871.5051626,913.0850094,47.1980592,no
52193,102,52193-102,27-6,8,100,,NA,2.5,0.02036,,7/5/2019,2019,7,5,27,38.73053833,-124.073795,497.79,2359,2359,871.5051626,913.0850094,47.1980592,no
52193,103,52193-103,27-6,9,50,,NA,2.5,0.20454,,7/5/2019,2019,7,5,27,38.73053833,-124.073795,497.79,2359,2359,871.5051626,913.0850094,47.1980592,no
52193,104,52193-104,27-6,10,50,,NA,2.5,0.20454,,7/5/2019,2019,7,5,27,38.73053833,-124.073795,497.79,2359,2359,871.5051626,913.0850094,47.1980592,no
52193,105,52193-105,27-6,sfc,0,,NA,2.5,4.6233,Yes,7/5/2019,2019,7,5,27,38.73053833,-124.073795,497.79,2359,2359,871.5051626,913.0850094,47.1980592,no
52193,106,52193-106,27-6,sfc,0,,NA,2.5,4.6233,Yes,7/5/2019,2019,7,5,27,38.73053833,-124.073795,497.79,2359,2359,871.5051626,913.0850094,47.1980592,no
52193,108,52193-108,27-4,1,500,,NA,2.5,0.01071,,7/5/2019,2019,7,5,27,38.73135,-123.861485,533.46,586,533.46,890.0152931,912.9380481,28.73685823,no
52193,109,52193-109,27-4,2,500,,NA,2.5,0.01071,,7/5/2019,2019,7,5,27,38.73135,-123.861485,533.46,586,533.46,890.0152931,912.9380481,28.73685823,no
52193,110,52193-110,27-4,3,300,,NA,2.5,0.00654,,7/5/2019,2019,7,5,27,38.73135,-123.861485,533.46,586,533.46,890.0152931,912.9380481,28.73685823,no
52193,111,52193-111,27-4,4,300,,NA,2.5,0.00654,,7/5/2019,2019,7,5,27,38.73135,-123.861485,533.46,586,533.46,890.0152931,912.9380481,28.73685823,no
52193,112,52193-112,27-4,5,150,,NA,2.5,0.00983,,7/5/2019,2019,7,5,27,38.73135,-123.861485,533.46,586,533.46,890.0152931,912.9380481,28.73685823,no
52193,113,52193-113,27-4,6,150,,NA,2.5,0.00983,,7/5/2019,2019,7,5,27,38.73135,-123.861485,533.46,586,533.46,890.0152931,912.9380481,28.73685823,no
52193,114,52193-114,27-4,7,100,,NA,2.5,0.015,,7/5/2019,2019,7,5,27,38.73135,-123.861485,533.46,586,533.46,890.0152931,912.9380481,28.73685823,no
52193,115,52193-115,27-4,8,100,,NA,2.5,0.015,,7/5/2019,2019,7,5,27,38.73135,-123.861485,533.46,586,533.46,890.0152931,912.9380481,28.73685823,no
52193,116,52193-116,27-4,9,50,,NA,2.5,0.02868,,7/5/2019,2019,7,5,27,38.73135,-123.861485,533.46,586,533.46,890.0152931,912.9380481,28.73685823,no
52193,117,52193-117,27-4,10,50,,NA,2.5,0.02868,,7/5/2019,2019,7,5,27,38.73135,-123.861485,533.46,586,533.46,890.0152931,912.9380481,28.73685823,no
52193,118,52193-118,27-4,sfc,0,,NA,2.5,7.8637,,7/5/2019,2019,7,5,27,38.73135,-123.861485,533.46,586,533.46,890.0152931,912.9380481,28.73685823,no
52193,119,52193-119,27-4,sfc,0,,NA,2.5,7.8637,,7/5/2019,2019,7,5,27,38.73135,-123.861485,533.46,586,533.46,890.0152931,912.9380481,28.73685823,no
52193,120,52193-120,27-2,1,145,,NA,2.5,0.01605,,7/5/2019,2019,7,5,27,38.730965,-123.7684633,149.31,170,149.31,898.1244482,912.8032507,20.64829574,no
52193,121,52193-121,27-2,2,145,,NA,2.5,0.01605,,7/5/2019,2019,7,5,27,38.730965,-123.7684633,149.31,170,149.31,898.1244482,912.8032507,20.64829574,no
52193,122,52193-122,27-2,3,100,,NA,2.5,0.00687,,7/5/2019,2019,7,5,27,38.730965,-123.7684633,149.31,170,149.31,898.1244482,912.8032507,20.64829574,no
52193,123,52193-123,27-2,4,100,,NA,2.5,0.00687,,7/5/2019,2019,7,5,27,38.730965,-123.7684633,149.31,170,149.31,898.1244482,912.8032507,20.64829574,no
52193,124,52193-124,27-2,5,50,,NA,2,0.76536,,7/5/2019,2019,7,5,27,38.730965,-123.7684633,149.31,170,149.31,898.1244482,912.8032507,20.64829574,no
52193,125,52193-125,27-2,6,50,,NA,2.5,0.76536,,7/5/2019,2019,7,5,27,38.730965,-123.7684633,149.31,170,149.31,898.1244482,912.8032507,20.64829574,no
52193,126,52193-126,27-2,sfc,0,,NA,2.5,5.47742,,7/5/2019,2019,7,5,27,38.730965,-123.7684633,149.31,170,149.31,898.1244482,912.8032507,20.64829574,no
52193,127,52193-127,27-2,sfc,0,,NA,2.5,5.47742,,7/5/2019,2019,7,5,27,38.730965,-123.7684633,149.31,170,149.31,898.1244482,912.8032507,20.64829574,no
52193,128,52193-128,27-1,1,35,,NA,2.5,2.00754,,7/5/2019,2019,7,5,27,38.73188,-123.526325,38.96,52,38.96,919.2358758,912.6977037,0.428272421,no
52193,129,52193-129,27-1,2,35,,NA,2.5,2.00754,,7/5/2019,2019,7,5,27,38.73188,-123.526325,38.96,52,38.96,919.2358758,912.6977037,0.428272421,no
52193,130,52193-130,27-1,3,25,,NA,2.5,0.68962,,7/5/2019,2019,7,5,27,38.73188,-123.526325,38.96,52,38.96,919.2358758,912.6977037,0.428272421,no
52193,131,52193-131,27-1,4,25,,NA,2.5,0.68962,,7/5/2019,2019,7,5,27,38.73188,-123.526325,38.96,52,38.96,919.2358758,912.6977037,0.428272421,no
52193,132,52193-132,27-1,5,0,,NA,2.5,0.74928,,7/5/2019,2019,7,5,27,38.73188,-123.526325,38.96,52,38.96,919.2358758,912.6977037,0.428272421,no
52193,133,52193-133,27-1,6,0,,NA,2.5,0.74928,,7/5/2019,2019,7,5,27,38.73188,-123.526325,38.96,52,38.96,919.2358758,912.6977037,0.428272421,no
52193,134,52193-134,27-1,sfc,0,,NA,2.5,0.74928,,7/5/2019,2019,7,5,27,38.73188,-123.526325,38.96,52,38.96,919.2358758,912.6977037,0.428272421,no
52193,135,52193-135,27-1,sfc,0,,NA,2.5,0.74928,Yes,7/5/2019,2019,7,5,27,38.73188,-123.526325,38.96,52,38.96,919.2358758,912.6977037,0.428272421,no
52193,136,52193-136,29-1,1,45,,NA,2.5,0.12032,,7/6/2019,2019,7,6,29,39.06565833,-123.7307767,53.55,67,53.55,901.8501459,949.8172071,0.249834568,no
52193,137,52193-137,29-1,2,45,,NA,2.5,0.12032,,7/6/2019,2019,7,6,29,39.06565833,-123.7307767,53.55,67,53.55,901.8501459,949.8172071,0.249834568,no
52193,138,52193-138,29-1,3,25,,NA,2.5,0.70308,,7/6/2019,2019,7,6,29,39.06565833,-123.7307767,53.55,67,53.55,901.8501459,949.8172071,0.249834568,no
52193,139,52193-139,29-1,4,25,,NA,2.5,0.70308,,7/6/2019,2019,7,6,29,39.06565833,-123.7307767,53.55,67,53.55,901.8501459,949.8172071,0.249834568,no
52193,140,52193-140,29-1,5,0,,NA,2.5,1.47941,,7/6/2019,2019,7,6,29,39.06565833,-123.7307767,53.55,67,53.55,901.8501459,949.8172071,0.249834568,no
52193,141,52193-141,29-1,6,0,,NA,2.5,1.47941,,7/6/2019,2019,7,6,29,39.06565833,-123.7307767,53.55,67,53.55,901.8501459,949.8172071,0.249834568,no
52193,142,52193-142,29-1,sfc,0,,NA,2.5,1.47941,,7/6/2019,2019,7,6,29,39.06565833,-123.7307767,53.55,67,53.55,901.8501459,949.8172071,0.249834568,no
52193,143,52193-143,29-1,sfc,0,,NA,2.5,1.47941,,7/6/2019,2019,7,6,29,39.06565833,-123.7307767,53.55,67,53.55,901.8501459,949.8172071,0.249834568,no
52193,144,52193-144,29-2,1,145,,NA,2.5,-0.0016,,7/6/2019,2019,7,6,29,39.064125,-123.9372133,158.35,226,158.35,883.9308196,949.8548118,17.65251099,no
52193,145,52193-145,29-2,2,145,,NA,2.5,-0.0016,,7/6/2019,2019,7,6,29,39.064125,-123.9372133,158.35,226,158.35,883.9308196,949.8548118,17.65251099,no
52193,146,52193-146,29-2,3,100,,NA,2.5,0.006,,7/6/2019,2019,7,6,29,39.064125,-123.9372133,158.35,226,158.35,883.9308196,949.8548118,17.65251099,no
52193,147,52193-147,29-2,4,100,,NA,2.5,0.006,,7/6/2019,2019,7,6,29,39.064125,-123.9372133,158.35,226,158.35,883.9308196,949.8548118,17.65251099,no
52193,148,52193-148,29-2,5,50,,NA,2.5,0.00282,,7/6/2019,2019,7,6,29,39.064125,-123.9372133,158.35,226,158.35,883.9308196,949.8548118,17.65251099,no
52193,149,52193-149,29-2,6,50,,NA,2.5,0.00282,,7/6/2019,2019,7,6,29,39.064125,-123.9372133,158.35,226,158.35,883.9308196,949.8548118,17.65251099,no
52193,150,52193-150,29-2,sfc,0,,NA,2.5,12.1975,Yes,7/6/2019,2019,7,6,29,39.064125,-123.9372133,158.35,226,158.35,883.9308196,949.8548118,17.65251099,no
52193,151,52193-151,29-2,sfc,0,,NA,2.5,12.1975,Yes,7/6/2019,2019,7,6,29,39.064125,-123.9372133,158.35,226,158.35,883.9308196,949.8548118,17.65251099,no
52193,152,52193-152,29-4,1,475,,NA,2.5,0.01932,,7/6/2019,2019,7,6,29,39.064665,-123.9845317,487.06,571,487.06,879.8248817,949.9669901,21.7476873,no
52193,153,52193-153,29-4,2,475,,NA,2.5,0.01932,,7/6/2019,2019,7,6,29,39.064665,-123.9845317,487.06,571,487.06,879.8248817,949.9669901,21.7476873,no
52193,154,52193-154,29-4,3,280,,NA,2.5,0.00863,,7/6/2019,2019,7,6,29,39.064665,-123.9845317,487.06,571,487.06,879.8248817,949.9669901,21.7476873,no
52193,155,52193-155,29-4,4,280,,NA,2.5,0.00863,,7/6/2019,2019,7,6,29,39.064665,-123.9845317,487.06,571,487.06,879.8248817,949.9669901,21.7476873,no
52193,156,52193-156,29-4,5,150,,NA,2.5,0.0025,,7/6/2019,2019,7,6,29,39.064665,-123.9845317,487.06,571,487.06,879.8248817,949.9669901,21.7476873,no
52193,157,52193-157,29-4,6,150,,NA,2.5,0.0025,,7/6/2019,2019,7,6,29,39.064665,-123.9845317,487.06,571,487.06,879.8248817,949.9669901,21.7476873,no
52193,158,52193-158,29-4,7,100,,NA,2.5,-0.0071,,7/6/2019,2019,7,6,29,39.064665,-123.9845317,487.06,571,487.06,879.8248817,949.9669901,21.7476873,no
52193,159,52193-159,29-4,8,100,,NA,2.5,-0.0071,,7/6/2019,2019,7,6,29,39.064665,-123.9845317,487.06,571,487.06,879.8248817,949.9669901,21.7476873,no
52193,160,52193-160,29-4,9,50,,NA,2.4,0.01383,,7/6/2019,2019,7,6,29,39.064665,-123.9845317,487.06,571,487.06,879.8248817,949.9669901,21.7476873,no
52193,161,52193-161,29-4,10,50,,NA,2.5,0.01383,,7/6/2019,2019,7,6,29,39.064665,-123.9845317,487.06,571,487.06,879.8248817,949.9669901,21.7476873,no
52193,162,52193-162,29-4,sfc,0,,NA,2.5,10.4112,Yes,7/6/2019,2019,7,6,29,39.064665,-123.9845317,487.06,571,487.06,879.8248817,949.9669901,21.7476873,no
52193,163,52193-163,29-4,sfc,0,,NA,2.5,10.4112,Yes,7/6/2019,2019,7,6,29,39.064665,-123.9845317,487.06,571,487.06,879.8248817,949.9669901,21.7476873,no
52193,166,52193-166,29-6,1,500,,NA,2.5,0.01153,,7/6/2019,2019,7,6,29,39.062135,-124.2069517,1308.11,1430,1308.11,860.5167695,949.9577179,40.99912953,no
52193,167,52193-167,29-6,2,500,,NA,2.5,0.01153,,7/6/2019,2019,7,6,29,39.062135,-124.2069517,1308.11,1430,1308.11,860.5167695,949.9577179,40.99912953,no
52193,168,52193-168,29-6,3,300,,NA,2.5,0.00959,,7/6/2019,2019,7,6,29,39.062135,-124.2069517,1308.11,1430,1308.11,860.5167695,949.9577179,40.99912953,no
52193,169,52193-169,29-6,4,300,,NA,2.5,0.00959,,7/6/2019,2019,7,6,29,39.062135,-124.2069517,1308.11,1430,1308.11,860.5167695,949.9577179,40.99912953,no
52193,170,52193-170,29-6,5,150,,NA,2.5,0.01787,,7/6/2019,2019,7,6,29,39.062135,-124.2069517,1308.11,1430,1308.11,860.5167695,949.9577179,40.99912953,no
52193,171,52193-171,29-6,6,150,,NA,2.5,0.01787,,7/6/2019,2019,7,6,29,39.062135,-124.2069517,1308.11,1430,1308.11,860.5167695,949.9577179,40.99912953,no
52193,172,52193-172,29-6,7,100,,NA,2.5,0.04238,,7/6/2019,2019,7,6,29,39.062135,-124.2069517,1308.11,1430,1308.11,860.5167695,949.9577179,40.99912953,no
52193,173,52193-173,29-6,8,100,,NA,2.5,0.04238,,7/6/2019,2019,7,6,29,39.062135,-124.2069517,1308.11,1430,1308.11,860.5167695,949.9577179,40.99912953,no
52193,174,52193-174,29-6,9,50,,NA,2.5,1.48859,Yes,7/6/2019,2019,7,6,29,39.062135,-124.2069517,1308.11,1430,1308.11,860.5167695,949.9577179,40.99912953,no
52193,175,52193-175,29-6,10,50,,NA,2.5,1.48859,Yes,7/6/2019,2019,7,6,29,39.062135,-124.2069517,1308.11,1430,1308.11,860.5167695,949.9577179,40.99912953,no
52193,176,52193-176,29-6,sfc,0,,NA,2.5,4.01056,Yes,7/6/2019,2019,7,6,29,39.062135,-124.2069517,1308.11,1430,1308.11,860.5167695,949.9577179,40.99912953,no
52193,177,52193-177,29-6,sfc,0,,NA,2.5,4.01056,Yes,7/6/2019,2019,7,6,29,39.062135,-124.2069517,1308.11,1430,1308.11,860.5167695,949.9577179,40.99912953,no
52193,178,52193-178,31-9,1,500,,NA,2.5,0.01086,,7/7/2019,2019,7,7,31,39.39722,-124.5593383,2769.28,2792,2769.28,830.7031493,987.5533512,61.65975011,no
52193,179,52193-179,31-9,2,500,,NA,2.5,0.01086,,7/7/2019,2019,7,7,31,39.39722,-124.5593383,2769.28,2792,2769.28,830.7031493,987.5533512,61.65975011,no
52193,180,52193-180,31-9,3,300,,NA,2.5,-0.0022,,7/7/2019,2019,7,7,31,39.39722,-124.5593383,2769.28,2792,2769.28,830.7031493,987.5533512,61.65975011,no
52193,181,52193-181,31-9,4,300,,NA,1.6,-0.0022,,7/7/2019,2019,7,7,31,39.39722,-124.5593383,2769.28,2792,2769.28,830.7031493,987.5533512,61.65975011,no
52193,182,52193-182,31-9,5,150,,NA,2.5,0.00626,,7/7/2019,2019,7,7,31,39.39722,-124.5593383,2769.28,2792,2769.28,830.7031493,987.5533512,61.65975011,no
52193,183,52193-183,31-9,6,150,,NA,2.5,0.00626,,7/7/2019,2019,7,7,31,39.39722,-124.5593383,2769.28,2792,2769.28,830.7031493,987.5533512,61.65975011,no
52193,184,52193-184,31-9,7,100,,NA,2.5,0.89654,,7/7/2019,2019,7,7,31,39.39722,-124.5593383,2769.28,2792,2769.28,830.7031493,987.5533512,61.65975011,no
52193,185,52193-185,31-9,8,100,,NA,2.5,0.89654,Yes,7/7/2019,2019,7,7,31,39.39722,-124.5593383,2769.28,2792,2769.28,830.7031493,987.5533512,61.65975011,no
52193,186,52193-186,31-9,9,50,,NA,2.5,3.13317,Yes,7/7/2019,2019,7,7,31,39.39722,-124.5593383,2769.28,2792,2769.28,830.7031493,987.5533512,61.65975011,no
52193,187,52193-187,31-9,10,50,,NA,2.5,3.13317,Yes,7/7/2019,2019,7,7,31,39.39722,-124.5593383,2769.28,2792,2769.28,830.7031493,987.5533512,61.65975011,no
52193,188,52193-188,31-9,sfc,0,,NA,2.5,2.47901,Yes,7/7/2019,2019,7,7,31,39.39722,-124.5593383,2769.28,2792,2769.28,830.7031493,987.5533512,61.65975011,no
52193,189,52193-189,31-9,sfc,0,,NA,2.5,2.47901,Yes,7/7/2019,2019,7,7,31,39.39722,-124.5593383,2769.28,2792,2769.28,830.7031493,987.5533512,61.65975011,no
52193,190,52193-190,31-7,1,500,,NA,2.5,0.01354,,7/7/2019,2019,7,7,31,39.395895,-124.3384933,1510.54,1542,1510.54,849.7794929,987.0751183,42.63736706,no
52193,191,52193-191,31-7,2,500,,NA,2.5,0.01354,,7/7/2019,2019,7,7,31,39.395895,-124.3384933,1510.54,1542,1510.54,849.7794929,987.0751183,42.63736706,no
52193,192,52193-192,31-7,3,300,,NA,2.5,0.00237,,7/7/2019,2019,7,7,31,39.395895,-124.3384933,1510.54,1542,1510.54,849.7794929,987.0751183,42.63736706,no
52193,193,52193-193,31-7,4,300,,NA,2.5,0.00237,,7/7/2019,2019,7,7,31,39.395895,-124.3384933,1510.54,1542,1510.54,849.7794929,987.0751183,42.63736706,no
52193,194,52193-194,31-7,5,150,,NA,2.5,#######,,7/7/2019,2019,7,7,31,39.395895,-124.3384933,1510.54,1542,1510.54,849.7794929,987.0751183,42.63736706,no
52193,195,52193-195,31-7,6,150,,NA,2.5,#######,,7/7/2019,2019,7,7,31,39.395895,-124.3384933,1510.54,1542,1510.54,849.7794929,987.0751183,42.63736706,no
52193,196,52193-196,31-7,7,100,,NA,2.5,0.01063,,7/7/2019,2019,7,7,31,39.395895,-124.3384933,1510.54,1542,1510.54,849.7794929,987.0751183,42.63736706,no
52193,197,52193-197,31-7,8,100,,NA,2.5,0.01063,,7/7/2019,2019,7,7,31,39.395895,-124.3384933,1510.54,1542,1510.54,849.7794929,987.0751183,42.63736706,no
52193,198,52193-198,31-7,9,50,,NA,2.5,2.47956,Yes,7/7/2019,2019,7,7,31,39.395895,-124.3384933,1510.54,1542,1510.54,849.7794929,987.0751183,42.63736706,no
52193,199,52193-199,31-7,10,50,,NA,2.5,2.47956,Yes,7/7/2019,2019,7,7,31,39.395895,-124.3384933,1510.54,1542,1510.54,849.7794929,987.0751183,42.63736706,no
52193,200,52193-200,31-7,sfc,0,,NA,2.5,2.14656,Yes,7/7/2019,2019,7,7,31,39.395895,-124.3384933,1510.54,1542,1510.54,849.7794929,987.0751183,42.63736706,no
52193,201,52193-201,31-7,sfc,0,,NA,2.5,2.14656,Yes,7/7/2019,2019,7,7,31,39.395895,-124.3384933,1510.54,1542,1510.54,849.7794929,987.0751183,42.63736706,no
52193,202,52193-202,31-4,1,494,,NA,2.5,0.01536,,7/7/2019,2019,7,7,31,39.39715167,-124.0178583,504.87,565,504.87,877.4840326,986.8032439,15.01734387,no
52193,203,52193-203,31-4,2,494,,NA,2.5,0.01536,,7/7/2019,2019,7,7,31,39.39715167,-124.0178583,504.87,565,504.87,877.4840326,986.8032439,15.01734387,no
52193,204,52193-204,31-4,3,300,,NA,2.5,0.01047,,7/7/2019,2019,7,7,31,39.39715167,-124.0178583,504.87,565,504.87,877.4840326,986.8032439,15.01734387,no
52193,205,52193-205,31-4,4,300,,NA,2.5,0.01047,,7/7/2019,2019,7,7,31,39.39715167,-124.0178583,504.87,565,504.87,877.4840326,986.8032439,15.01734387,no
52193,206,52193-206,31-4,5,150,,NA,2.5,0.00915,,7/7/2019,2019,7,7,31,39.39715167,-124.0178583,504.87,565,504.87,877.4840326,986.8032439,15.01734387,no
52193,207,52193-207,31-4,6,150,,NA,2.5,0.00915,,7/7/2019,2019,7,7,31,39.39715167,-124.0178583,504.87,565,504.87,877.4840326,986.8032439,15.01734387,no
52193,208,52193-208,31-4,7,100,,NA,2.5,0.04101,,7/7/2019,2019,7,7,31,39.39715167,-124.0178583,504.87,565,504.87,877.4840326,986.8032439,15.01734387,no
52193,209,52193-209,31-4,8,100,,NA,2.5,0.04101,,7/7/2019,2019,7,7,31,39.39715167,-124.0178583,504.87,565,504.87,877.4840326,986.8032439,15.01734387,no
52193,210,52193-210,31-4,9,50,,NA,2.5,0.19303,,7/7/2019,2019,7,7,31,39.39715167,-124.0178583,504.87,565,504.87,877.4840326,986.8032439,15.01734387,no
52193,211,52193-211,31-4,10,50,,NA,2.5,0.19303,,7/7/2019,2019,7,7,31,39.39715167,-124.0178583,504.87,565,504.87,877.4840326,986.8032439,15.01734387,no
52193,212,52193-212,31-4,sfc,0,,NA,2.5,10.4558,Yes,7/7/2019,2019,7,7,31,39.39715167,-124.0178583,504.87,565,504.87,877.4840326,986.8032439,15.01734387,no
52193,213,52193-213,31-4,sfc,0,,NA,2.5,10.4558,Yes,7/7/2019,2019,7,7,31,39.39715167,-124.0178583,504.87,565,504.87,877.4840326,986.8032439,15.01734387,no
52193,215,52193-215,31-2,1,146,,NA,2.5,0.01106,,7/7/2019,2019,7,7,31,39.39729833,-123.9491633,153.76,197,153.76,883.4195848,986.7422921,9.100019565,no
52193,216,52193-216,31-2,2,146,,NA,2.5,0.01106,,7/7/2019,2019,7,7,31,39.39729833,-123.9491633,153.76,197,153.76,883.4195848,986.7422921,9.100019565,no
52193,217,52193-217,31-2,3,100,,NA,2.5,0.0375,,7/7/2019,2019,7,7,31,39.39729833,-123.9491633,153.76,197,153.76,883.4195848,986.7422921,9.100019565,no
52193,218,52193-218,31-2,4,100,,NA,2.5,0.0375,,7/7/2019,2019,7,7,31,39.39729833,-123.9491633,153.76,197,153.76,883.4195848,986.7422921,9.100019565,no
52193,219,52193-219,31-2,5,50,,NA,2.5,0.20151,,7/7/2019,2019,7,7,31,39.39729833,-123.9491633,153.76,197,153.76,883.4195848,986.7422921,9.100019565,no
52193,220,52193-220,31-2,6,50,,NA,2.5,0.20151,,7/7/2019,2019,7,7,31,39.39729833,-123.9491633,153.76,197,153.76,883.4195848,986.7422921,9.100019565,no
52193,221,52193-221,31-2,sfc,0,,NA,2.5,9.62193,Yes,7/7/2019,2019,7,7,31,39.39729833,-123.9491633,153.76,197,153.76,883.4195848,986.7422921,9.100019565,no
52193,222,52193-222,31-2,sfc,0,,NA,2.5,9.62193,Yes,7/7/2019,2019,7,7,31,39.39729833,-123.9491633,153.76,197,153.76,883.4195848,986.7422921,9.100019565,no
52193,223,52193-223,31-1,1,25,,NA,2.5,0.96127,,7/7/2019,2019,7,7,31,39.39802167,-123.834825,40.13,79,40.13,893.2997475,986.7023738,0.749352778,no
52193,224,52193-224,31-1,2,25,,NA,2.5,0.96127,,7/7/2019,2019,7,7,31,39.39802167,-123.834825,40.13,79,40.13,893.2997475,986.7023738,0.749352778,no
52193,225,52193-225,31-1,sfc,0,,NA,2.5,1.6884,Yes,7/7/2019,2019,7,7,31,39.39802167,-123.834825,40.13,79,40.13,893.2997475,986.7023738,0.749352778,no
52193,226,52193-226,31-1,sfc,0,,NA,2.5,1.6884,Yes,7/7/2019,2019,7,7,31,39.39802167,-123.834825,40.13,79,40.13,893.2997475,986.7023738,0.749352778,no
52193,227,52193-227,33-9,1,500,,NA,2.5,0.01193,,7/8/2019,2019,7,8,33,39.73059833,-124.6214717,1619.19,1635,1619.19,826.1289029,1024.542377,64.93616609,no
52193,228,52193-228,33-9,2,500,,NA,2.5,0.01193,,7/8/2019,2019,7,8,33,39.73059833,-124.6214717,1619.19,1635,1619.19,826.1289029,1024.542377,64.93616609,no
52193,229,52193-229,33-9,3,300,,NA,2.5,0.00791,,7/8/2019,2019,7,8,33,39.73059833,-124.6214717,1619.19,1635,1619.19,826.1289029,1024.542377,64.93616609,no
52193,230,52193-230,33-9,4,300,,NA,2.5,0.00791,,7/8/2019,2019,7,8,33,39.73059833,-124.6214717,1619.19,1635,1619.19,826.1289029,1024.542377,64.93616609,no
52193,231,52193-231,33-9,5,150,,NA,2.5,0.00267,,7/8/2019,2019,7,8,33,39.73059833,-124.6214717,1619.19,1635,1619.19,826.1289029,1024.542377,64.93616609,no
52193,232,52193-232,33-9,6,150,,NA,2.5,0.00267,,7/8/2019,2019,7,8,33,39.73059833,-124.6214717,1619.19,1635,1619.19,826.1289029,1024.542377,64.93616609,no
52193,233,52193-233,33-9,7,100,,NA,2.5,-0.0017,,7/8/2019,2019,7,8,33,39.73059833,-124.6214717,1619.19,1635,1619.19,826.1289029,1024.542377,64.93616609,no
52193,234,52193-234,33-9,8,100,,NA,2.5,-0.0017,,7/8/2019,2019,7,8,33,39.73059833,-124.6214717,1619.19,1635,1619.19,826.1289029,1024.542377,64.93616609,no
52193,235,52193-235,33-9,9,50,,NA,2.5,0.20772,,7/8/2019,2019,7,8,33,39.73059833,-124.6214717,1619.19,1635,1619.19,826.1289029,1024.542377,64.93616609,no
52193,236,52193-236,33-9,10,50,,NA,2.5,0.20772,,7/8/2019,2019,7,8,33,39.73059833,-124.6214717,1619.19,1635,1619.19,826.1289029,1024.542377,64.93616609,no
52193,237,52193-237,33-9,sfc,0,,NA,2.5,0.63256,Yes,7/8/2019,2019,7,8,33,39.73059833,-124.6214717,1619.19,1635,1619.19,826.1289029,1024.542377,64.93616609,no
52193,238,52193-238,33-9,sfc,0,,NA,2.5,0.63256,Yes,7/8/2019,2019,7,8,33,39.73059833,-124.6214717,1619.19,1635,1619.19,826.1289029,1024.542377,64.93616609,no
52193,239,52193-239,33-5,1,500,,NA,2.5,0.01282,,7/8/2019,2019,7,8,33,39.73188333,-124.1845433,1038.83,1179,1038.83,863.7070132,1024.046204,27.47913301,no
52193,240,52193-240,33-5,2,500,,NA,2.5,0.01282,,7/8/2019,2019,7,8,33,39.73188333,-124.1845433,1038.83,1179,1038.83,863.7070132,1024.046204,27.47913301,no
52193,241,52193-241,33-5,3,300,,NA,2.5,0.00674,,7/8/2019,2019,7,8,33,39.73188333,-124.1845433,1038.83,1179,1038.83,863.7070132,1024.046204,27.47913301,no
52193,242,52193-242,33-5,4,300,,NA,2.5,0.00674,,7/8/2019,2019,7,8,33,39.73188333,-124.1845433,1038.83,1179,1038.83,863.7070132,1024.046204,27.47913301,no
52193,243,52193-243,33-5,5,150,,NA,2.5,0.01474,,7/8/2019,2019,7,8,33,39.73188333,-124.1845433,1038.83,1179,1038.83,863.7070132,1024.046204,27.47913301,no
52193,244,52193-244,33-5,6,150,,NA,2.5,0.01474,,7/8/2019,2019,7,8,33,39.73188333,-124.1845433,1038.83,1179,1038.83,863.7070132,1024.046204,27.47913301,no
52193,245,52193-245,33-5,7,100,,NA,2.5,0.02135,,7/8/2019,2019,7,8,33,39.73188333,-124.1845433,1038.83,1179,1038.83,863.7070132,1024.046204,27.47913301,no
52193,246,52193-246,33-5,8,100,,NA,2.5,0.02135,,7/8/2019,2019,7,8,33,39.73188333,-124.1845433,1038.83,1179,1038.83,863.7070132,1024.046204,27.47913301,no
52193,247,52193-247,33-5,9,50,,NA,2.5,2.51035,Yes,7/8/2019,2019,7,8,33,39.73188333,-124.1845433,1038.83,1179,1038.83,863.7070132,1024.046204,27.47913301,no
52193,248,52193-248,33-5,10,50,,NA,2.5,2.51035,,7/8/2019,2019,7,8,33,39.73188333,-124.1845433,1038.83,1179,1038.83,863.7070132,1024.046204,27.47913301,no
52193,249,52193-249,33-5,sfc,0,,NA,2.5,4.3844,Yes,7/8/2019,2019,7,8,33,39.73188333,-124.1845433,1038.83,1179,1038.83,863.7070132,1024.046204,27.47913301,no
52193,250,52193-250,33-5,sfc,0,,NA,2.5,4.3844,Yes,7/8/2019,2019,7,8,33,39.73188333,-124.1845433,1038.83,1179,1038.83,863.7070132,1024.046204,27.47913301,no
52193,251,52193-251,33-4,1,467,,NA,2.5,0.02174,,7/8/2019,2019,7,8,33,39.731755,-124.07336,475.44,523,475.44,873.2690284,1023.894258,17.94789641,no
52193,252,52193-252,33-4,2,467,,NA,2.5,0.02174,,7/8/2019,2019,7,8,33,39.731755,-124.07336,475.44,523,475.44,873.2690284,1023.894258,17.94789641,no
52193,253,52193-253,33-4,3,300,,NA,2.5,0.01044,,7/8/2019,2019,7,8,33,39.731755,-124.07336,475.44,523,475.44,873.2690284,1023.894258,17.94789641,no
52193,254,52193-254,33-4,4,300,,NA,2.5,0.01044,,7/8/2019,2019,7,8,33,39.731755,-124.07336,475.44,523,475.44,873.2690284,1023.894258,17.94789641,no
52193,255,52193-255,33-4,5,150,,NA,2.5,0.00718,,7/8/2019,2019,7,8,33,39.731755,-124.07336,475.44,523,475.44,873.2690284,1023.894258,17.94789641,no
52193,256,52193-256,33-4,6,150,,NA,2.5,0.00718,,7/8/2019,2019,7,8,33,39.731755,-124.07336,475.44,523,475.44,873.2690284,1023.894258,17.94789641,no
52193,257,52193-257,33-4,7,100,,NA,2.5,0.02132,,7/8/2019,2019,7,8,33,39.731755,-124.07336,475.44,523,475.44,873.2690284,1023.894258,17.94789641,no
52193,258,52193-258,33-4,8,100,,NA,2.5,0.02132,,7/8/2019,2019,7,8,33,39.731755,-124.07336,475.44,523,475.44,873.2690284,1023.894258,17.94789641,no
52193,259,52193-259,33-4,9,50,,NA,2.5,0.18234,,7/8/2019,2019,7,8,33,39.731755,-124.07336,475.44,523,475.44,873.2690284,1023.894258,17.94789641,no
52193,260,52193-260,33-4,10,50,,NA,2.5,0.18234,,7/8/2019,2019,7,8,33,39.731755,-124.07336,475.44,523,475.44,873.2690284,1023.894258,17.94789641,no
52193,261,52193-261,33-4,sfc,0,,NA,2.5,13.704,Yes,7/8/2019,2019,7,8,33,39.731755,-124.07336,475.44,523,475.44,873.2690284,1023.894258,17.94789641,no
52193,262,52193-262,33-4,sfc,0,,NA,2.5,13.704,Yes,7/8/2019,2019,7,8,33,39.731755,-124.07336,475.44,523,475.44,873.2690284,1023.894258,17.94789641,no
52193,263,52193-263,33-2,1,137,,NA,2.5,0.01771,,7/8/2019,2019,7,8,33,39.73248333,-123.9517533,147.48,156,147.48,883.7291704,1023.835655,7.52275671,no
52193,264,52193-264,33-2,2,137,,NA,2.5,0.01771,,7/8/2019,2019,7,8,33,39.73248333,-123.9517533,147.48,156,147.48,883.7291704,1023.835655,7.52275671,no
52193,265,52193-265,33-2,3,100,,NA,2.5,0.03311,,7/8/2019,2019,7,8,33,39.73248333,-123.9517533,147.48,156,147.48,883.7291704,1023.835655,7.52275671,no
52193,266,52193-266,33-2,4,100,,NA,2.5,0.03311,,7/8/2019,2019,7,8,33,39.73248333,-123.9517533,147.48,156,147.48,883.7291704,1023.835655,7.52275671,no
52193,267,52193-267,33-2,5,50,,NA,2.5,0.04218,,7/8/2019,2019,7,8,33,39.73248333,-123.9517533,147.48,156,147.48,883.7291704,1023.835655,7.52275671,no
52193,268,52193-268,33-2,6,50,,NA,2.5,0.04218,,7/8/2019,2019,7,8,33,39.73248333,-123.9517533,147.48,156,147.48,883.7291704,1023.835655,7.52275671,no
52193,269,52193-269,33-2,sfc,0,,NA,2.5,6.87277,,7/8/2019,2019,7,8,33,39.73248333,-123.9517533,147.48,156,147.48,883.7291704,1023.835655,7.52275671,no
52193,270,52193-270,33-2,sfc,0,,NA,2.5,6.87277,,7/8/2019,2019,7,8,33,39.73248333,-123.9517533,147.48,156,147.48,883.7291704,1023.835655,7.52275671,no
52193,271,52193-271,33-1,1,50,,NA,2.5,0.15295,,7/8/2019,2019,7,8,33,39.73022833,-123.8644517,60.73,105,60.73,891.2344129,1023.493609,0.251938704,no
52193,272,52193-272,33-1,2,50,,NA,2.5,0.15295,,7/8/2019,2019,7,8,33,39.73022833,-123.8644517,60.73,105,60.73,891.2344129,1023.493609,0.251938704,no
52193,273,52193-273,33-1,3,25,,NA,2.5,1.50098,,7/8/2019,2019,7,8,33,39.73022833,-123.8644517,60.73,105,60.73,891.2344129,1023.493609,0.251938704,no
52193,274,52193-274,33-1,4,25,,NA,2.5,1.50098,,7/8/2019,2019,7,8,33,39.73022833,-123.8644517,60.73,105,60.73,891.2344129,1023.493609,0.251938704,no
52193,275,52193-275,33-1,5,0,,NA,2.5,16.8433,Yes,7/8/2019,2019,7,8,33,39.73022833,-123.8644517,60.73,105,60.73,891.2344129,1023.493609,0.251938704,no
52193,276,52193-276,33-1,6,0,,NA,2.5,16.8433,Yes,7/8/2019,2019,7,8,33,39.73022833,-123.8644517,60.73,105,60.73,891.2344129,1023.493609,0.251938704,no
52193,277,52193-277,33-1,sfc,0,,NA,2.5,16.8433,Yes,7/8/2019,2019,7,8,33,39.73022833,-123.8644517,60.73,105,60.73,891.2344129,1023.493609,0.251938704,no
52193,278,52193-278,33-1,sfc,0,,NA,2.5,16.8433,Yes,7/8/2019,2019,7,8,33,39.73022833,-123.8644517,60.73,105,60.73,891.2344129,1023.493609,0.251938704,no
52193,282,52193-282,35-1,1,48,,NA,2.5,0.09139,,7/9/2019,2019,7,9,35,40.065505,-124.1372783,57.38,211,57.38,868.3793865,1060.896655,0.374291005,no
52193,283,52193-283,35-1,2,48,,NA,2.5,0.09139,,7/9/2019,2019,7,9,35,40.065505,-124.1372783,57.38,211,57.38,868.3793865,1060.896655,0.374291005,no
52193,284,52193-284,35-1,3,25,,NA,2.5,2.3781,,7/9/2019,2019,7,9,35,40.065505,-124.1372783,57.38,211,57.38,868.3793865,1060.896655,0.374291005,no
52193,285,52193-285,35-1,4,25,,NA,2.5,2.3781,,7/9/2019,2019,7,9,35,40.065505,-124.1372783,57.38,211,57.38,868.3793865,1060.896655,0.374291005,no
52193,286,52193-286,35-1,sfc,0,,NA,2.5,9.36501,Yes,7/9/2019,2019,7,9,35,40.065505,-124.1372783,57.38,211,57.38,868.3793865,1060.896655,0.374291005,no
52193,287,52193-287,35-1,sfc,0,,NA,2.5,9.36501,Yes,7/9/2019,2019,7,9,35,40.065505,-124.1372783,57.38,211,57.38,868.3793865,1060.896655,0.374291005,no
52193,288,52193-288,35-3,1,300,,NA,2.5,0.00892,,7/9/2019,2019,7,9,35,40.06306,-124.2782183,306.7,391,306.7,856.3089904,1060.809376,11.65568082,no
52193,289,52193-289,35-3,2,300,,NA,2.5,0.00892,,7/9/2019,2019,7,9,35,40.06306,-124.2782183,306.7,391,306.7,856.3089904,1060.809376,11.65568082,no
52193,290,52193-290,35-3,3,150,,NA,2.5,0.01031,,7/9/2019,2019,7,9,35,40.06306,-124.2782183,306.7,391,306.7,856.3089904,1060.809376,11.65568082,no
52193,291,52193-291,35-3,4,150,,NA,2.5,0.01031,,7/9/2019,2019,7,9,35,40.06306,-124.2782183,306.7,391,306.7,856.3089904,1060.809376,11.65568082,no
52193,292,52193-292,35-3,5,100,,NA,2.5,0.01162,,7/9/2019,2019,7,9,35,40.06306,-124.2782183,306.7,391,306.7,856.3089904,1060.809376,11.65568082,no
52193,293,52193-293,35-3,6,100,,NA,2.5,0.01162,,7/9/2019,2019,7,9,35,40.06306,-124.2782183,306.7,391,306.7,856.3089904,1060.809376,11.65568082,no
52193,294,52193-294,35-3,7,50,,NA,2.5,2.31144,,7/9/2019,2019,7,9,35,40.06306,-124.2782183,306.7,391,306.7,856.3089904,1060.809376,11.65568082,no
52193,295,52193-295,35-3,8,50,,NA,2.5,2.31144,,7/9/2019,2019,7,9,35,40.06306,-124.2782183,306.7,391,306.7,856.3089904,1060.809376,11.65568082,no
52193,296,52193-296,35-3,sfc,0,,NA,2.5,10.6138,Yes,7/9/2019,2019,7,9,35,40.06306,-124.2782183,306.7,391,306.7,856.3089904,1060.809376,11.65568082,no
52193,297,52193-297,35-3,sfc,0,,NA,2.5,10.6138,,7/9/2019,2019,7,9,35,40.06306,-124.2782183,306.7,391,306.7,856.3089904,1060.809376,11.65568082,no
52193,298,52193-298,35-5,1,500,,NA,2.5,0.01061,,7/9/2019,2019,7,9,35,40.06066,-124.421245,736.31,789,736.31,844.0596718,1060.746212,23.86115244,no
52193,299,52193-299,35-5,2,500,,NA,2.5,0.01061,,7/9/2019,2019,7,9,35,40.06066,-124.421245,736.31,789,736.31,844.0596718,1060.746212,23.86115244,no
52193,300,52193-300,35-5,3,300,,NA,2.5,0.00707,,7/9/2019,2019,7,9,35,40.06066,-124.421245,736.31,789,736.31,844.0596718,1060.746212,23.86115244,no
52193,301,52193-301,35-5,4,300,,NA,2.5,0.00707,,7/9/2019,2019,7,9,35,40.06066,-124.421245,736.31,789,736.31,844.0596718,1060.746212,23.86115244,no
52193,302,52193-302,35-5,5,150,,NA,2.5,0.07369,,7/9/2019,2019,7,9,35,40.06066,-124.421245,736.31,789,736.31,844.0596718,1060.746212,23.86115244,no
52193,303,52193-303,35-5,6,150,,NA,2.5,0.07369,,7/9/2019,2019,7,9,35,40.06066,-124.421245,736.31,789,736.31,844.0596718,1060.746212,23.86115244,no
52193,304,52193-304,35-5,7,100,,NA,2.5,0.75032,,7/9/2019,2019,7,9,35,40.06066,-124.421245,736.31,789,736.31,844.0596718,1060.746212,23.86115244,no
52193,305,52193-305,35-5,8,100,,NA,2.5,0.75032,,7/9/2019,2019,7,9,35,40.06066,-124.421245,736.31,789,736.31,844.0596718,1060.746212,23.86115244,no
52193,306,52193-306,35-5,9,50,,NA,2.5,0.4127,,7/9/2019,2019,7,9,35,40.06066,-124.421245,736.31,789,736.31,844.0596718,1060.746212,23.86115244,no
52193,307,52193-307,35-5,10,50,,NA,2.5,0.4127,,7/9/2019,2019,7,9,35,40.06066,-124.421245,736.31,789,736.31,844.0596718,1060.746212,23.86115244,no
52193,308,52193-308,35-5,sfc,0,,NA,2.5,1.02238,Yes,7/9/2019,2019,7,9,35,40.06066,-124.421245,736.31,789,736.31,844.0596718,1060.746212,23.86115244,no
52193,309,52193-309,35-5,sfc,0,,NA,2.5,1.02238,Yes,7/9/2019,2019,7,9,35,40.06066,-124.421245,736.31,789,736.31,844.0596718,1060.746212,23.86115244,no
52193,310,52193-310,35-7,1,500,,NA,2.5,0.01349,,7/9/2019,2019,7,9,35,40.06181,-124.6436167,913.3,936,913.3,825.0261719,1061.220849,42.82906189,no
52193,311,52193-311,35-7,2,500,,NA,2.5,0.01349,,7/9/2019,2019,7,9,35,40.06181,-124.6436167,913.3,936,913.3,825.0261719,1061.220849,42.82906189,no
52193,312,52193-312,35-7,3,300,,NA,2.5,0.01259,,7/9/2019,2019,7,9,35,40.06181,-124.6436167,913.3,936,913.3,825.0261719,1061.220849,42.82906189,no
52193,313,52193-313,35-7,4,300,,NA,2.5,0.01259,,7/9/2019,2019,7,9,35,40.06181,-124.6436167,913.3,936,913.3,825.0261719,1061.220849,42.82906189,no
52193,314,52193-314,35-7,5,150,,NA,2.5,0.0214,,7/9/2019,2019,7,9,35,40.06181,-124.6436167,913.3,936,913.3,825.0261719,1061.220849,42.82906189,no
52193,315,52193-315,35-7,6,150,,NA,2.5,0.0214,,7/9/2019,2019,7,9,35,40.06181,-124.6436167,913.3,936,913.3,825.0261719,1061.220849,42.82906189,no
52193,316,52193-316,35-7,7,100,,NA,2.5,0.18504,,7/9/2019,2019,7,9,35,40.06181,-124.6436167,913.3,936,913.3,825.0261719,1061.220849,42.82906189,no
52193,317,52193-317,35-7,8,100,,NA,2.5,0.18504,,7/9/2019,2019,7,9,35,40.06181,-124.6436167,913.3,936,913.3,825.0261719,1061.220849,42.82906189,no
52193,318,52193-318,35-7,9,50,,NA,2.5,1.46624,Yes,7/9/2019,2019,7,9,35,40.06181,-124.6436167,913.3,936,913.3,825.0261719,1061.220849,42.82906189,no
52193,319,52193-319,35-7,10,50,,NA,2.5,1.46624,Yes,7/9/2019,2019,7,9,35,40.06181,-124.6436167,913.3,936,913.3,825.0261719,1061.220849,42.82906189,no
52193,320,52193-320,35-7,sfc,0,,NA,2.5,2.3009,Yes,7/9/2019,2019,7,9,35,40.06181,-124.6436167,913.3,936,913.3,825.0261719,1061.220849,42.82906189,no
52193,321,52193-321,35-7,sfc,0,,NA,2.5,2.3009,Yes,7/9/2019,2019,7,9,35,40.06181,-124.6436167,913.3,936,913.3,825.0261719,1061.220849,42.82906189,no
52193,322,52193-322,35-9,1,500,,NA,2.5,0.0129,,7/9/2019,2019,7,9,35,40.06103167,-124.85885,1165.91,1210,1165.91,806.6004233,1061.509096,61.19200968,no
52193,323,52193-323,35-9,2,500,,NA,2.5,0.0129,,7/9/2019,2019,7,9,35,40.06103167,-124.85885,1165.91,1210,1165.91,806.6004233,1061.509096,61.19200968,no
52193,324,52193-324,35-9,3,300,,NA,2.5,0.00956,,7/9/2019,2019,7,9,35,40.06103167,-124.85885,1165.91,1210,1165.91,806.6004233,1061.509096,61.19200968,no
52193,325,52193-325,35-9,4,300,,NA,2.5,0.00956,,7/9/2019,2019,7,9,35,40.06103167,-124.85885,1165.91,1210,1165.91,806.6004233,1061.509096,61.19200968,no
52193,326,52193-326,35-9,5,150,,NA,2.5,0.04486,,7/9/2019,2019,7,9,35,40.06103167,-124.85885,1165.91,1210,1165.91,806.6004233,1061.509096,61.19200968,no
52193,327,52193-327,35-9,6,150,,NA,2.5,0.04486,,7/9/2019,2019,7,9,35,40.06103167,-124.85885,1165.91,1210,1165.91,806.6004233,1061.509096,61.19200968,no
52193,328,52193-328,35-9,7,100,,NA,2.5,0.10145,,7/9/2019,2019,7,9,35,40.06103167,-124.85885,1165.91,1210,1165.91,806.6004233,1061.509096,61.19200968,no
52193,329,52193-329,35-9,8,100,,NA,2.5,0.10145,,7/9/2019,2019,7,9,35,40.06103167,-124.85885,1165.91,1210,1165.91,806.6004233,1061.509096,61.19200968,no
52193,330,52193-330,35-9,9,50,,NA,2.5,0.4844,,7/9/2019,2019,7,9,35,40.06103167,-124.85885,1165.91,1210,1165.91,806.6004233,1061.509096,61.19200968,no
52193,331,52193-331,35-9,10,50,,NA,2.5,0.4844,,7/9/2019,2019,7,9,35,40.06103167,-124.85885,1165.91,1210,1165.91,806.6004233,1061.509096,61.19200968,no
52193,332,52193-332,35-9,sfc,0,,NA,2.5,0.70944,Yes,7/9/2019,2019,7,9,35,40.06103167,-124.85885,1165.91,1210,1165.91,806.6004233,1061.509096,61.19200968,no
52193,333,52193-333,35-9,sfc,0,,NA,2.5,0.70944,Yes,7/9/2019,2019,7,9,35,40.06103167,-124.85885,1165.91,1210,1165.91,806.6004233,1061.509096,61.19200968,no
52193,334,52193-334,35-11,1,500,,NA,2.5,0.00795,,7/9/2019,2019,7,9,35,40.06377,-125.0781317,1408.93,1414,1408.93,787.8394955,1062.231899,79.89680001,no
52193,335,52193-335,35-11,2,500,,NA,2.5,0.00795,,7/9/2019,2019,7,9,35,40.06377,-125.0781317,1408.93,1414,1408.93,787.8394955,1062.231899,79.89680001,no
52193,336,52193-336,35-11,3,300,,NA,2.5,0.0048,,7/9/2019,2019,7,9,35,40.06377,-125.0781317,1408.93,1414,1408.93,787.8394955,1062.231899,79.89680001,no
52193,337,52193-337,35-11,4,300,,NA,2.5,0.0048,,7/9/2019,2019,7,9,35,40.06377,-125.0781317,1408.93,1414,1408.93,787.8394955,1062.231899,79.89680001,no
52193,338,52193-338,35-11,5,150,,NA,2.5,-0.0089,,7/9/2019,2019,7,9,35,40.06377,-125.0781317,1408.93,1414,1408.93,787.8394955,1062.231899,79.89680001,no
52193,339,52193-339,35-11,6,150,,NA,2.5,-0.0089,,7/9/2019,2019,7,9,35,40.06377,-125.0781317,1408.93,1414,1408.93,787.8394955,1062.231899,79.89680001,no
52193,340,52193-340,35-11,7,100,,NA,2.5,0.10619,,7/9/2019,2019,7,9,35,40.06377,-125.0781317,1408.93,1414,1408.93,787.8394955,1062.231899,79.89680001,no
52193,341,52193-341,35-11,8,100,,NA,2.5,0.10619,,7/9/2019,2019,7,9,35,40.06377,-125.0781317,1408.93,1414,1408.93,787.8394955,1062.231899,79.89680001,no
52193,342,52193-342,35-11,9,50,,NA,2.5,0.9537,,7/9/2019,2019,7,9,35,40.06377,-125.0781317,1408.93,1414,1408.93,787.8394955,1062.231899,79.89680001,no
52193,343,52193-343,35-11,10,50,,NA,2.5,0.9537,,7/9/2019,2019,7,9,35,40.06377,-125.0781317,1408.93,1414,1408.93,787.8394955,1062.231899,79.89680001,no
52193,344,52193-344,35-11,sfc,0,,NA,2.5,0.72785,Yes,7/9/2019,2019,7,9,35,40.06377,-125.0781317,1408.93,1414,1408.93,787.8394955,1062.231899,79.89680001,no
52193,345,52193-345,35-11,sfc,0,,NA,2.5,0.72785,Yes,7/9/2019,2019,7,9,35,40.06377,-125.0781317,1408.93,1414,1408.93,787.8394955,1062.231899,79.89680001,no
52193,348,52193-348,37-9,1,500,,NA,2.5,0.02111,,7/10/2019,2019,7,10,37,40.39612,-125.1259683,2390.95,2276,2390.95,784.7455854,1099.087409,57.63605269,no
52193,349,52193-349,37-9,2,500,,NA,2.5,0.02111,,7/10/2019,2019,7,10,37,40.39612,-125.1259683,2390.95,2276,2390.95,784.7455854,1099.087409,57.63605269,no
52193,350,52193-350,37-9,3,300,,NA,2.5,0.01353,,7/10/2019,2019,7,10,37,40.39612,-125.1259683,2390.95,2276,2390.95,784.7455854,1099.087409,57.63605269,no
52193,351,52193-351,37-9,4,300,,NA,2.5,0.01353,,7/10/2019,2019,7,10,37,40.39612,-125.1259683,2390.95,2276,2390.95,784.7455854,1099.087409,57.63605269,no
52193,352,52193-352,37-9,5,150,,NA,2.5,0.04422,,7/10/2019,2019,7,10,37,40.39612,-125.1259683,2390.95,2276,2390.95,784.7455854,1099.087409,57.63605269,no
52193,353,52193-353,37-9,6,150,,NA,2.5,0.04422,,7/10/2019,2019,7,10,37,40.39612,-125.1259683,2390.95,2276,2390.95,784.7455854,1099.087409,57.63605269,no
52193,354,52193-354,37-9,7,100,,NA,2.5,0.11768,,7/10/2019,2019,7,10,37,40.39612,-125.1259683,2390.95,2276,2390.95,784.7455854,1099.087409,57.63605269,no
52193,355,52193-355,37-9,8,100,,NA,2.5,0.11768,,7/10/2019,2019,7,10,37,40.39612,-125.1259683,2390.95,2276,2390.95,784.7455854,1099.087409,57.63605269,no
52193,356,52193-356,37-9,9,50,,NA,2.5,0.42895,Yes,7/10/2019,2019,7,10,37,40.39612,-125.1259683,2390.95,2276,2390.95,784.7455854,1099.087409,57.63605269,no
52193,357,52193-357,37-9,10,50,,NA,2.5,0.42895,,7/10/2019,2019,7,10,37,40.39612,-125.1259683,2390.95,2276,2390.95,784.7455854,1099.087409,57.63605269,no
52193,358,52193-358,37-9,sfc,0,,NA,2.5,0.51647,Yes,7/10/2019,2019,7,10,37,40.39612,-125.1259683,2390.95,2276,2390.95,784.7455854,1099.087409,57.63605269,no
52193,359,52193-359,37-9,sfc,0,,NA,2.5,0.51647,Yes,7/10/2019,2019,7,10,37,40.39612,-125.1259683,2390.95,2276,2390.95,784.7455854,1099.087409,57.63605269,no
52193,360,52193-360,37-7,1,500,,NA,2.5,0.01345,,7/10/2019,2019,7,10,37,40.39824,-124.9122883,2211.29,2292,2211.29,802.9553249,1098.904917,39.4942718,no
52193,361,52193-361,37-7,2,500,,NA,2.5,0.01345,,7/10/2019,2019,7,10,37,40.39824,-124.9122883,2211.29,2292,2211.29,802.9553249,1098.904917,39.4942718,no
52193,362,52193-362,37-7,3,300,,NA,2.5,0.01319,,7/10/2019,2019,7,10,37,40.39824,-124.9122883,2211.29,2292,2211.29,802.9553249,1098.904917,39.4942718,no
52193,363,52193-363,37-7,4,300,,NA,2.5,0.01319,,7/10/2019,2019,7,10,37,40.39824,-124.9122883,2211.29,2292,2211.29,802.9553249,1098.904917,39.4942718,no
52193,364,52193-364,37-7,5,150,,NA,2.5,0.05708,,7/10/2019,2019,7,10,37,40.39824,-124.9122883,2211.29,2292,2211.29,802.9553249,1098.904917,39.4942718,no
52193,365,52193-365,37-7,6,150,,NA,2.5,0.05708,,7/10/2019,2019,7,10,37,40.39824,-124.9122883,2211.29,2292,2211.29,802.9553249,1098.904917,39.4942718,no
52193,366,52193-366,37-7,7,100,,NA,2.5,0.20336,,7/10/2019,2019,7,10,37,40.39824,-124.9122883,2211.29,2292,2211.29,802.9553249,1098.904917,39.4942718,no
52193,367,52193-367,37-7,8,100,,NA,2.5,0.20336,,7/10/2019,2019,7,10,37,40.39824,-124.9122883,2211.29,2292,2211.29,802.9553249,1098.904917,39.4942718,no
52193,368,52193-368,37-7,9,50,,NA,2.5,0.2589,,7/10/2019,2019,7,10,37,40.39824,-124.9122883,2211.29,2292,2211.29,802.9553249,1098.904917,39.4942718,no
52193,369,52193-369,37-7,10,50,,NA,2.5,0.2589,Yes,7/10/2019,2019,7,10,37,40.39824,-124.9122883,2211.29,2292,2211.29,802.9553249,1098.904917,39.4942718,no
52193,370,52193-370,37-7,sfc,0,,NA,2.5,0.62872,Yes,7/10/2019,2019,7,10,37,40.39824,-124.9122883,2211.29,2292,2211.29,802.9553249,1098.904917,39.4942718,no
52193,371,52193-371,37-7,sfc,0,,NA,2.5,0.62872,Yes,7/10/2019,2019,7,10,37,40.39824,-124.9122883,2211.29,2292,2211.29,802.9553249,1098.904917,39.4942718,no
52193,372,52193-372,37-5,1,500,,NA,2.5,0.0157,,7/10/2019,2019,7,10,37,40.39516167,-124.6909867,1368.45,1891,1368.45,821.8017116,1098.171467,20.70989683,no
52193,373,52193-373,37-5,2,500,,NA,2.5,0.0157,,7/10/2019,2019,7,10,37,40.39516167,-124.6909867,1368.45,1891,1368.45,821.8017116,1098.171467,20.70989683,no
52193,374,52193-374,37-5,3,300,,NA,2.5,0.01082,,7/10/2019,2019,7,10,37,40.39516167,-124.6909867,1368.45,1891,1368.45,821.8017116,1098.171467,20.70989683,no
52193,375,52193-375,37-5,4,300,,NA,2.5,0.01082,,7/10/2019,2019,7,10,37,40.39516167,-124.6909867,1368.45,1891,1368.45,821.8017116,1098.171467,20.70989683,no
52193,376,52193-376,37-5,5,150,,NA,2.5,0.02892,,7/10/2019,2019,7,10,37,40.39516167,-124.6909867,1368.45,1891,1368.45,821.8017116,1098.171467,20.70989683,no
52193,377,52193-377,37-5,6,150,,NA,2.5,0.02892,,7/10/2019,2019,7,10,37,40.39516167,-124.6909867,1368.45,1891,1368.45,821.8017116,1098.171467,20.70989683,no
52193,378,52193-378,37-5,7,100,,NA,2.5,0.06369,,7/10/2019,2019,7,10,37,40.39516167,-124.6909867,1368.45,1891,1368.45,821.8017116,1098.171467,20.70989683,no
52193,379,52193-379,37-5,8,100,,NA,2.5,0.06369,,7/10/2019,2019,7,10,37,40.39516167,-124.6909867,1368.45,1891,1368.45,821.8017116,1098.171467,20.70989683,no
52193,380,52193-380,37-5,9,50,,NA,2.5,0.12997,,7/10/2019,2019,7,10,37,40.39516167,-124.6909867,1368.45,1891,1368.45,821.8017116,1098.171467,20.70989683,no
52193,381,52193-381,37-5,10,50,,NA,2.5,0.12997,,7/10/2019,2019,7,10,37,40.39516167,-124.6909867,1368.45,1891,1368.45,821.8017116,1098.171467,20.70989683,no
52193,382,52193-382,37-5,sfc,0,,NA,2.5,0.61434,Yes,7/10/2019,2019,7,10,37,40.39516167,-124.6909867,1368.45,1891,1368.45,821.8017116,1098.171467,20.70989683,no
52193,383,52193-383,37-5,sfc,0,,NA,2.5,0.61434,Yes,7/10/2019,2019,7,10,37,40.39516167,-124.6909867,1368.45,1891,1368.45,821.8017116,1098.171467,20.70989683,no
52193,384,52193-384,37-4,1,425,,NA,2.5,0.0294,,7/10/2019,2019,7,10,37,40.39651833,-124.5772267,432.9,626,432.9,831.4977935,1098.134862,11.05065761,no
52193,385,52193-385,37-4,2,425,,NA,2.5,0.0294,,7/10/2019,2019,7,10,37,40.39651833,-124.5772267,432.9,626,432.9,831.4977935,1098.134862,11.05065761,no
52193,386,52193-386,37-4,3,300,,NA,2.5,0.05479,,7/10/2019,2019,7,10,37,40.39651833,-124.5772267,432.9,626,432.9,831.4977935,1098.134862,11.05065761,no
52193,387,52193-387,37-4,4,300,,NA,2.5,0.05479,,7/10/2019,2019,7,10,37,40.39651833,-124.5772267,432.9,626,432.9,831.4977935,1098.134862,11.05065761,no
52193,388,52193-388,37-4,5,150,,NA,2.5,0.07101,,7/10/2019,2019,7,10,37,40.39651833,-124.5772267,432.9,626,432.9,831.4977935,1098.134862,11.05065761,no
52193,389,52193-389,37-4,6,150,,NA,2.5,0.07101,,7/10/2019,2019,7,10,37,40.39651833,-124.5772267,432.9,626,432.9,831.4977935,1098.134862,11.05065761,no
52193,390,52193-390,37-4,7,100,,NA,2.5,0.10102,,7/10/2019,2019,7,10,37,40.39651833,-124.5772267,432.9,626,432.9,831.4977935,1098.134862,11.05065761,no
52193,391,52193-391,37-4,8,100,,NA,2.5,0.10102,,7/10/2019,2019,7,10,37,40.39651833,-124.5772267,432.9,626,432.9,831.4977935,1098.134862,11.05065761,no
52193,392,52193-392,37-4,9,50,,NA,2.5,0.08311,,7/10/2019,2019,7,10,37,40.39651833,-124.5772267,432.9,626,432.9,831.4977935,1098.134862,11.05065761,no
52193,393,52193-393,37-4,10,50,,NA,2.5,0.08311,,7/10/2019,2019,7,10,37,40.39651833,-124.5772267,432.9,626,432.9,831.4977935,1098.134862,11.05065761,no
52193,394,52193-394,37-4,sfc,0,,NA,2.5,0.5005,Yes,7/10/2019,2019,7,10,37,40.39651833,-124.5772267,432.9,626,432.9,831.4977935,1098.134862,11.05065761,no
52193,395,52193-395,37-4,sfc,0,,NA,2.5,0.5005,Yes,7/10/2019,2019,7,10,37,40.39651833,-124.5772267,432.9,626,432.9,831.4977935,1098.134862,11.05065761,no
52193,396,52193-396,37-2,1,137,,NA,2.5,0.12931,,7/10/2019,2019,7,10,37,40.39806333,-124.5435133,136.11,146,136.11,834.3739236,1098.252429,8.186901258,no
52193,397,52193-397,37-2,2,137,,NA,2.5,0.12931,,7/10/2019,2019,7,10,37,40.39806333,-124.5435133,136.11,146,136.11,834.3739236,1098.252429,8.186901258,no
52193,398,52193-398,37-2,3,100,,NA,2.5,0.10732,,7/10/2019,2019,7,10,37,40.39806333,-124.5435133,136.11,146,136.11,834.3739236,1098.252429,8.186901258,no
52193,399,52193-399,37-2,4,100,,NA,2.5,0.10732,,7/10/2019,2019,7,10,37,40.39806333,-124.5435133,136.11,146,136.11,834.3739236,1098.252429,8.186901258,no
52193,400,52193-400,37-2,5,50,,NA,2.5,0.1963,,7/10/2019,2019,7,10,37,40.39806333,-124.5435133,136.11,146,136.11,834.3739236,1098.252429,8.186901258,no
52193,401,52193-401,37-2,6,50,,NA,2.5,0.1963,,7/10/2019,2019,7,10,37,40.39806333,-124.5435133,136.11,146,136.11,834.3739236,1098.252429,8.186901258,no
52193,402,52193-402,37-2,sfc,0,,NA,2.5,0.24162,Yes,7/10/2019,2019,7,10,37,40.39806333,-124.5435133,136.11,146,136.11,834.3739236,1098.252429,8.186901258,no
52193,403,52193-403,37-2,sfc,0,,NA,2.5,0.24162,Yes,7/10/2019,2019,7,10,37,40.39806333,-124.5435133,136.11,146,136.11,834.3739236,1098.252429,8.186901258,no
52193,404,52193-404,37-1,1,47,,NA,2.5,0.56033,,7/10/2019,2019,7,10,37,40.3966,-124.447735,51.89,440,51.89,842.5314561,1097.944139,0.182668835,no
52193,405,52193-405,37-1,2,47,,NA,2.5,0.56033,,7/10/2019,2019,7,10,37,40.3966,-124.447735,51.89,440,51.89,842.5314561,1097.944139,0.182668835,no
52193,406,52193-406,37-1,3,25,,NA,2.5,0.50602,,7/10/2019,2019,7,10,37,40.3966,-124.447735,51.89,440,51.89,842.5314561,1097.944139,0.182668835,no
52193,407,52193-407,37-1,4,25,,NA,2.5,0.50602,,7/10/2019,2019,7,10,37,40.3966,-124.447735,51.89,440,51.89,842.5314561,1097.944139,0.182668835,no
52193,408,52193-408,37-1,sfc,0,,NA,2.5,2.4642,,7/10/2019,2019,7,10,37,40.3966,-124.447735,51.89,440,51.89,842.5314561,1097.944139,0.182668835,no
52193,409,52193-409,37-1,sfc,0,,NA,2.5,2.4642,,7/10/2019,2019,7,10,37,40.3966,-124.447735,51.89,440,51.89,842.5314561,1097.944139,0.182668835,no
52193,413,52193-413,38-1,1,45,,NA,2.5,0.43067,,7/11/2019,2019,7,11,38,40.56358833,-124.452305,55.04,55,55.04,842.512245,1116.418896,0.270892135,no
52193,414,52193-414,38-1,2,45,,NA,2.5,0.43067,,7/11/2019,2019,7,11,38,40.56358833,-124.452305,55.04,55,55.04,842.512245,1116.418896,0.270892135,no
52193,415,52193-415,38-1,3,25,,NA,2.5,0.36166,,7/11/2019,2019,7,11,38,40.56358833,-124.452305,55.04,55,55.04,842.512245,1116.418896,0.270892135,no
52193,416,52193-416,38-1,4,25,,NA,2.5,0.36166,,7/11/2019,2019,7,11,38,40.56358833,-124.452305,55.04,55,55.04,842.512245,1116.418896,0.270892135,no
52193,417,52193-417,38-1,sfc,0,,NA,2.5,0.29555,Yes,7/11/2019,2019,7,11,38,40.56358833,-124.452305,55.04,55,55.04,842.512245,1116.418896,0.270892135,no
52193,418,52193-418,38-1,sfc,0,,NA,2.5,0.29555,Yes,7/11/2019,2019,7,11,38,40.56358833,-124.452305,55.04,55,55.04,842.512245,1116.418896,0.270892135,no
52193,419,52193-419,38-2,1,500,,NA,2.5,0.01336,,7/11/2019,2019,7,11,38,40.5655825,-124.7830292,1477.985,1860,1477.985,814.4047765,1117.177023,27.76496039,no
52193,420,52193-420,38-2,2,500,,NA,2.5,0.01336,,7/11/2019,2019,7,11,38,40.5655825,-124.7830292,1477.985,1860,1477.985,814.4047765,1117.177023,27.76496039,no
52193,421,52193-421,38-2,3,300,,NA,2.5,0.01273,,7/11/2019,2019,7,11,38,40.5655825,-124.7830292,1477.985,1860,1477.985,814.4047765,1117.177023,27.76496039,no
52193,422,52193-422,38-2,4,300,,NA,2.5,0.01273,,7/11/2019,2019,7,11,38,40.5655825,-124.7830292,1477.985,1860,1477.985,814.4047765,1117.177023,27.76496039,no
52193,423,52193-423,38-2,5,150,,NA,2.5,0.03276,,7/11/2019,2019,7,11,38,40.5655825,-124.7830292,1477.985,1860,1477.985,814.4047765,1117.177023,27.76496039,no
52193,424,52193-424,38-2,6,150,,NA,2.5,0.03276,,7/11/2019,2019,7,11,38,40.5655825,-124.7830292,1477.985,1860,1477.985,814.4047765,1117.177023,27.76496039,no
52193,425,52193-425,38-2,7,100,,NA,2.5,0.07952,,7/11/2019,2019,7,11,38,40.5655825,-124.7830292,1477.985,1860,1477.985,814.4047765,1117.177023,27.76496039,no
52193,426,52193-426,38-2,8,100,,NA,2.5,0.07952,,7/11/2019,2019,7,11,38,40.5655825,-124.7830292,1477.985,1860,1477.985,814.4047765,1117.177023,27.76496039,no
52193,427,52193-427,38-2,9,50,,NA,2.5,0.10805,,7/11/2019,2019,7,11,38,40.5655825,-124.7830292,1477.985,1860,1477.985,814.4047765,1117.177023,27.76496039,no
52193,428,52193-428,38-2,10,50,,NA,2.5,0.10805,,7/11/2019,2019,7,11,38,40.5655825,-124.7830292,1477.985,1860,1477.985,814.4047765,1117.177023,27.76496039,no
52193,429,52193-429,38-2,sfc,0,,NA,2.5,0.44663,Yes,7/11/2019,2019,7,11,38,40.5655825,-124.7830292,1477.985,1860,1477.985,814.4047765,1117.177023,27.76496039,no
52193,430,52193-430,38-2,sfc,0,,NA,2.5,0.44663,Yes,7/11/2019,2019,7,11,38,40.5655825,-124.7830292,1477.985,1860,1477.985,814.4047765,1117.177023,27.76496039,no
52193,431,52193-431,38-3,1,500,,NA,2.5,0.01131,,7/11/2019,2019,7,11,38,40.561005,-125.1123733,2706.24,2656,2706.24,786.3994939,1117.293765,55.65879854,no
52193,432,52193-432,38-3,2,500,,NA,2.5,0.01131,,7/11/2019,2019,7,11,38,40.561005,-125.1123733,2706.24,2656,2706.24,786.3994939,1117.293765,55.65879854,no
52193,433,52193-433,38-3,3,300,,NA,2.5,0.01171,,7/11/2019,2019,7,11,38,40.561005,-125.1123733,2706.24,2656,2706.24,786.3994939,1117.293765,55.65879854,no
52193,434,52193-434,38-3,4,300,,NA,2.5,0.01171,,7/11/2019,2019,7,11,38,40.561005,-125.1123733,2706.24,2656,2706.24,786.3994939,1117.293765,55.65879854,no
52193,435,52193-435,38-3,5,150,,NA,2.5,0.03838,,7/11/2019,2019,7,11,38,40.561005,-125.1123733,2706.24,2656,2706.24,786.3994939,1117.293765,55.65879854,no
52193,436,52193-436,38-3,6,150,,NA,2.5,0.03838,,7/11/2019,2019,7,11,38,40.561005,-125.1123733,2706.24,2656,2706.24,786.3994939,1117.293765,55.65879854,no
52193,437,52193-437,38-3,7,100,,NA,2.5,0.08541,,7/11/2019,2019,7,11,38,40.561005,-125.1123733,2706.24,2656,2706.24,786.3994939,1117.293765,55.65879854,no
52193,438,52193-438,38-3,8,100,,NA,2.5,0.08541,,7/11/2019,2019,7,11,38,40.561005,-125.1123733,2706.24,2656,2706.24,786.3994939,1117.293765,55.65879854,no
52193,439,52193-439,38-3,9,50,,NA,2.5,0.09201,,7/11/2019,2019,7,11,38,40.561005,-125.1123733,2706.24,2656,2706.24,786.3994939,1117.293765,55.65879854,no
52193,440,52193-440,38-3,10,50,,NA,2.5,0.09201,,7/11/2019,2019,7,11,38,40.561005,-125.1123733,2706.24,2656,2706.24,786.3994939,1117.293765,55.65879854,no
52193,441,52193-441,38-3,sfc,0,,NA,2.5,0.41841,Yes,7/11/2019,2019,7,11,38,40.561005,-125.1123733,2706.24,2656,2706.24,786.3994939,1117.293765,55.65879854,no
52193,442,52193-442,38-3,sfc,0,,NA,2.5,0.41841,Yes,7/11/2019,2019,7,11,38,40.561005,-125.1123733,2706.24,2656,2706.24,786.3994939,1117.293765,55.65879854,no
52193,443,52193-443,38-4,1,500,,NA,2.5,0.01291,,7/11/2019,2019,7,11,38,40.56516333,-125.3394233,2813.48,2813,2813.48,767.1165943,1118.233929,74.88337977,no
52193,444,52193-444,38-4,2,500,,NA,2.5,0.01291,,7/11/2019,2019,7,11,38,40.56516333,-125.3394233,2813.48,2813,2813.48,767.1165943,1118.233929,74.88337977,no
52193,445,52193-445,38-4,3,300,,NA,2.5,0.00941,,7/11/2019,2019,7,11,38,40.56516333,-125.3394233,2813.48,2813,2813.48,767.1165943,1118.233929,74.88337977,no
52193,446,52193-446,38-4,4,300,,NA,2.5,0.00941,,7/11/2019,2019,7,11,38,40.56516333,-125.3394233,2813.48,2813,2813.48,767.1165943,1118.233929,74.88337977,no
52193,447,52193-447,38-4,5,150,,NA,2.5,0.061,,7/11/2019,2019,7,11,38,40.56516333,-125.3394233,2813.48,2813,2813.48,767.1165943,1118.233929,74.88337977,no
52193,448,52193-448,38-4,6,150,,NA,2.5,0.061,,7/11/2019,2019,7,11,38,40.56516333,-125.3394233,2813.48,2813,2813.48,767.1165943,1118.233929,74.88337977,no
52193,449,52193-449,38-4,7,100,,NA,2.5,0.03984,,7/11/2019,2019,7,11,38,40.56516333,-125.3394233,2813.48,2813,2813.48,767.1165943,1118.233929,74.88337977,no
52193,450,52193-450,38-4,8,100,,NA,2.5,0.03984,,7/11/2019,2019,7,11,38,40.56516333,-125.3394233,2813.48,2813,2813.48,767.1165943,1118.233929,74.88337977,no
52193,451,52193-451,38-4,9,50,,NA,2.5,0.54616,,7/11/2019,2019,7,11,38,40.56516333,-125.3394233,2813.48,2813,2813.48,767.1165943,1118.233929,74.88337977,no
52193,452,52193-452,38-4,10,50,,NA,2.5,0.54616,,7/11/2019,2019,7,11,38,40.56516333,-125.3394233,2813.48,2813,2813.48,767.1165943,1118.233929,74.88337977,no
52193,453,52193-453,38-4,sfc,0,,NA,2.5,0.20404,Yes,7/11/2019,2019,7,11,38,40.56516333,-125.3394233,2813.48,2813,2813.48,767.1165943,1118.233929,74.88337977,no
52193,454,52193-454,38-4,sfc,0,,NA,2.5,0.20404,,7/11/2019,2019,7,11,38,40.56516333,-125.3394233,2813.48,2813,2813.48,767.1165943,1118.233929,74.88337977,no
52193,456,52193-456,39-1,1,42,,NA,2,0.82282,Yes,7/12/2019,2019,7,12,39,40.72985,-124.3734867,52.49,49,52.49,849.5664265,1134.689593,0.226472545,no
52193,457,52193-457,39-1,2,42,,NA,1.3,0.82282,,7/12/2019,2019,7,12,39,40.72985,-124.3734867,52.49,49,52.49,849.5664265,1134.689593,0.226472545,no
52193,458,52193-458,39-1,3,25,,NA,1,0.85719,,7/12/2019,2019,7,12,39,40.72985,-124.3734867,52.49,49,52.49,849.5664265,1134.689593,0.226472545,no
52193,459,52193-459,39-1,4,25,,NA,1.8,0.85719,,7/12/2019,2019,7,12,39,40.72985,-124.3734867,52.49,49,52.49,849.5664265,1134.689593,0.226472545,no
52193,460,52193-460,39-1,5,0,,NA,2.5,8.97643,Yes,7/12/2019,2019,7,12,39,40.72985,-124.3734867,52.49,49,52.49,849.5664265,1134.689593,0.226472545,no
52193,461,52193-461,39-1,6,0,,NA,2.5,8.97643,Yes,7/12/2019,2019,7,12,39,40.72985,-124.3734867,52.49,49,52.49,849.5664265,1134.689593,0.226472545,no
52193,462,52193-462,39-1,sfc,0,,NA,2.5,8.97643,Yes,7/12/2019,2019,7,12,39,40.72985,-124.3734867,52.49,49,52.49,849.5664265,1134.689593,0.226472545,no
52193,463,52193-463,39-1,sfc,0,,NA,2.5,8.97643,Yes,7/12/2019,2019,7,12,39,40.72985,-124.3734867,52.49,49,52.49,849.5664265,1134.689593,0.226472545,no
52193,464,52193-464,39-2,1,142,,NA,2.5,0.13218,,7/12/2019,2019,7,12,39,40.73203833,-124.4885933,153.76,191,153.76,839.809361,1135.101172,9.785195692,no
52193,465,52193-465,39-2,2,142,,NA,2.5,0.13218,,7/12/2019,2019,7,12,39,40.73203833,-124.4885933,153.76,191,153.76,839.809361,1135.101172,9.785195692,no
52193,466,52193-466,39-2,3,100,,NA,2.5,0.14398,,7/12/2019,2019,7,12,39,40.73203833,-124.4885933,153.76,191,153.76,839.809361,1135.101172,9.785195692,no
52193,467,52193-467,39-2,4,100,,NA,2.5,0.14398,,7/12/2019,2019,7,12,39,40.73203833,-124.4885933,153.76,191,153.76,839.809361,1135.101172,9.785195692,no
52193,468,52193-468,39-2,5,50,Y,NA,2.5,0.11005,,7/12/2019,2019,7,12,39,40.73203833,-124.4885933,153.76,191,153.76,839.809361,1135.101172,9.785195692,no
52193,469,52193-469,39-2,6,50,,NA,2.5,0.11005,,7/12/2019,2019,7,12,39,40.73203833,-124.4885933,153.76,191,153.76,839.809361,1135.101172,9.785195692,no
52193,470,52193-470,39-2,sfc,0,,NA,2.5,3.67399,Yes,7/12/2019,2019,7,12,39,40.73203833,-124.4885933,153.76,191,153.76,839.809361,1135.101172,9.785195692,no
52193,471,52193-471,39-2,sfc,0,,NA,2.5,3.67399,Yes,7/12/2019,2019,7,12,39,40.73203833,-124.4885933,153.76,191,153.76,839.809361,1135.101172,9.785195692,no
52193,472,52193-472,39-4,1,300,,NA,2.5,0.02164,,7/12/2019,2019,7,12,39,40.72983833,-124.544465,470.58,528,470.58,835.0660845,1134.94407,14.50682501,no
52193,473,52193-473,39-4,2,300,,NA,2.5,0.02164,,7/12/2019,2019,7,12,39,40.72983833,-124.544465,470.58,528,470.58,835.0660845,1134.94407,14.50682501,no
52193,474,52193-474,39-4,3,150,,NA,2.5,0.07947,,7/12/2019,2019,7,12,39,40.72983833,-124.544465,470.58,528,470.58,835.0660845,1134.94407,14.50682501,no
52193,475,52193-475,39-4,4,150,,NA,2.5,0.07947,,7/12/2019,2019,7,12,39,40.72983833,-124.544465,470.58,528,470.58,835.0660845,1134.94407,14.50682501,no
52193,476,52193-476,39-4,5,100,,NA,2.5,0.10142,,7/12/2019,2019,7,12,39,40.72983833,-124.544465,470.58,528,470.58,835.0660845,1134.94407,14.50682501,no
52193,477,52193-477,39-4,6,100,,NA,2.5,0.10142,,7/12/2019,2019,7,12,39,40.72983833,-124.544465,470.58,528,470.58,835.0660845,1134.94407,14.50682501,no
52193,478,52193-478,39-5,1,500,,NA,2.5,0.01439,,7/12/2019,2019,7,12,39,40.73091833,-124.6617817,863.22,837,863.22,825.1198038,1135.252592,24.41566957,no
52193,479,52193-479,39-5,2,500,,NA,2.5,0.01439,,7/12/2019,2019,7,12,39,40.73091833,-124.6617817,863.22,837,863.22,825.1198038,1135.252592,24.41566957,no
52193,480,52193-480,39-5,3,300,,NA,2.5,0.01243,,7/12/2019,2019,7,12,39,40.73091833,-124.6617817,863.22,837,863.22,825.1198038,1135.252592,24.41566957,no
52193,481,52193-481,39-5,4,300,,NA,2.5,0.01243,,7/12/2019,2019,7,12,39,40.73091833,-124.6617817,863.22,837,863.22,825.1198038,1135.252592,24.41566957,no
52193,482,52193-482,39-5,5,150,,NA,2.5,0.02117,,7/12/2019,2019,7,12,39,40.73091833,-124.6617817,863.22,837,863.22,825.1198038,1135.252592,24.41566957,no
52193,483,52193-483,39-5,6,150,,NA,2.5,0.02117,,7/12/2019,2019,7,12,39,40.73091833,-124.6617817,863.22,837,863.22,825.1198038,1135.252592,24.41566957,no
52193,484,52193-484,39-5,7,100,,NA,2.5,0.05663,,7/12/2019,2019,7,12,39,40.73091833,-124.6617817,863.22,837,863.22,825.1198038,1135.252592,24.41566957,no
52193,485,52193-485,39-5,8,100,,NA,2.5,0.05663,,7/12/2019,2019,7,12,39,40.73091833,-124.6617817,863.22,837,863.22,825.1198038,1135.252592,24.41566957,no
52193,486,52193-486,39-5,9,50,,NA,2.5,0.2363,,7/12/2019,2019,7,12,39,40.73091833,-124.6617817,863.22,837,863.22,825.1198038,1135.252592,24.41566957,no
52193,487,52193-487,39-5,10,50,,NA,2.5,0.2363,,7/12/2019,2019,7,12,39,40.73091833,-124.6617817,863.22,837,863.22,825.1198038,1135.252592,24.41566957,no
52193,488,52193-488,39-5,sfc,0,,NA,2.5,4.43038,Yes,7/12/2019,2019,7,12,39,40.73091833,-124.6617817,863.22,837,863.22,825.1198038,1135.252592,24.41566957,no
52193,489,52193-489,39-5,sfc,0,,NA,2.5,4.43038,Yes,7/12/2019,2019,7,12,39,40.73091833,-124.6617817,863.22,837,863.22,825.1198038,1135.252592,24.41566957,no
52193,490,52193-490,39-7,1,500,,NA,2.5,0.01752,,7/12/2019,2019,7,12,39,40.73095167,-124.8794483,2451.7,2508,2451.7,806.6621056,1135.636468,42.80309268,no
52193,491,52193-491,39-7,2,500,,NA,2.5,0.01752,,7/12/2019,2019,7,12,39,40.73095167,-124.8794483,2451.7,2508,2451.7,806.6621056,1135.636468,42.80309268,no
52193,492,52193-492,39-7,3,300,,NA,2.4,0.01267,,7/12/2019,2019,7,12,39,40.73095167,-124.8794483,2451.7,2508,2451.7,806.6621056,1135.636468,42.80309268,no
52193,493,52193-493,39-7,4,300,,NA,2.5,0.01267,,7/12/2019,2019,7,12,39,40.73095167,-124.8794483,2451.7,2508,2451.7,806.6621056,1135.636468,42.80309268,no
52193,494,52193-494,39-7,5,150,,NA,2.5,0.02038,,7/12/2019,2019,7,12,39,40.73095167,-124.8794483,2451.7,2508,2451.7,806.6621056,1135.636468,42.80309268,no
52193,495,52193-495,39-7,6,150,,NA,2.5,0.02038,,7/12/2019,2019,7,12,39,40.73095167,-124.8794483,2451.7,2508,2451.7,806.6621056,1135.636468,42.80309268,no
52193,496,52193-496,39-7,7,100,,NA,2.5,0.04084,,7/12/2019,2019,7,12,39,40.73095167,-124.8794483,2451.7,2508,2451.7,806.6621056,1135.636468,42.80309268,no
52193,497,52193-497,39-7,8,100,,NA,2.5,0.04084,,7/12/2019,2019,7,12,39,40.73095167,-124.8794483,2451.7,2508,2451.7,806.6621056,1135.636468,42.80309268,no
52193,498,52193-498,39-7,9,50,,NA,2.5,0.08879,,7/12/2019,2019,7,12,39,40.73095167,-124.8794483,2451.7,2508,2451.7,806.6621056,1135.636468,42.80309268,no
52193,499,52193-499,39-7,10,50,,NA,2.5,0.08879,,7/12/2019,2019,7,12,39,40.73095167,-124.8794483,2451.7,2508,2451.7,806.6621056,1135.636468,42.80309268,no
52193,500,52193-500,39-7,sfc,0,,NA,2.5,0.19729,Yes,7/12/2019,2019,7,12,39,40.73095167,-124.8794483,2451.7,2508,2451.7,806.6621056,1135.636468,42.80309268,no
52193,501,52193-501,39-7,sfc,0,,NA,2.5,0.19729,Yes,7/12/2019,2019,7,12,39,40.73095167,-124.8794483,2451.7,2508,2451.7,806.6621056,1135.636468,42.80309268,no
52193,502,52193-502,39-9,1,500,,NA,2.5,0.01142,,7/12/2019,2019,7,12,39,40.72901667,-125.1001667,2697.91,2731,2697.91,787.9411721,1135.846969,61.44990889,no
52193,503,52193-503,39-9,2,500,,NA,2.5,0.01142,Yes,7/12/2019,2019,7,12,39,40.72901667,-125.1001667,2697.91,2731,2697.91,787.9411721,1135.846969,61.44990889,no
52193,504,52193-504,39-9,3,300,,NA,2.5,0.01271,,7/12/2019,2019,7,12,39,40.72901667,-125.1001667,2697.91,2731,2697.91,787.9411721,1135.846969,61.44990889,no
52193,505,52193-505,39-9,4,300,,NA,2.5,0.01271,,7/12/2019,2019,7,12,39,40.72901667,-125.1001667,2697.91,2731,2697.91,787.9411721,1135.846969,61.44990889,no
52193,506,52193-506,39-9,5,150,,NA,2.5,0.05007,,7/12/2019,2019,7,12,39,40.72901667,-125.1001667,2697.91,2731,2697.91,787.9411721,1135.846969,61.44990889,no
52193,507,52193-507,39-9,6,150,,NA,2.5,0.05007,,7/12/2019,2019,7,12,39,40.72901667,-125.1001667,2697.91,2731,2697.91,787.9411721,1135.846969,61.44990889,no
52193,508,52193-508,39-9,7,100,,NA,2.5,0.24642,,7/12/2019,2019,7,12,39,40.72901667,-125.1001667,2697.91,2731,2697.91,787.9411721,1135.846969,61.44990889,no
52193,509,52193-509,39-9,8,100,,NA,2.5,0.24642,,7/12/2019,2019,7,12,39,40.72901667,-125.1001667,2697.91,2731,2697.91,787.9411721,1135.846969,61.44990889,no
52193,510,52193-510,39-9,9,50,,NA,2.5,0.62216,,7/12/2019,2019,7,12,39,40.72901667,-125.1001667,2697.91,2731,2697.91,787.9411721,1135.846969,61.44990889,no
52193,511,52193-511,39-9,10,50,,NA,2.5,0.62216,,7/12/2019,2019,7,12,39,40.72901667,-125.1001667,2697.91,2731,2697.91,787.9411721,1135.846969,61.44990889,no
52193,512,52193-512,39-9,sfc,0,,NA,2.5,0.47345,,7/12/2019,2019,7,12,39,40.72901667,-125.1001667,2697.91,2731,2697.91,787.9411721,1135.846969,61.44990889,no
52193,513,52193-513,39-9,sfc,0,,NA,2.5,0.47345,Yes,7/12/2019,2019,7,12,39,40.72901667,-125.1001667,2697.91,2731,2697.91,787.9411721,1135.846969,61.44990889,no
52193,515,52193-515,42-4,1,500,,NA,2.5,0.01237,,7/13/2019,2019,7,13,42,41.23130333,-124.9554167,1702.71,1902,1702.71,801.6435523,1191.093478,64.85720759,no
52193,516,52193-516,42-4,2,500,,NA,2.5,0.01237,,7/13/2019,2019,7,13,42,41.23130333,-124.9554167,1702.71,1902,1702.71,801.6435523,1191.093478,64.85720759,no
52193,517,52193-517,42-4,3,300,,NA,2.5,0.00397,,7/13/2019,2019,7,13,42,41.23130333,-124.9554167,1702.71,1902,1702.71,801.6435523,1191.093478,64.85720759,no
52193,518,52193-518,42-4,4,300,,NA,2.5,0.00397,,7/13/2019,2019,7,13,42,41.23130333,-124.9554167,1702.71,1902,1702.71,801.6435523,1191.093478,64.85720759,no
52193,519,52193-519,42-4,5,150,,NA,2.5,0.04061,,7/13/2019,2019,7,13,42,41.23130333,-124.9554167,1702.71,1902,1702.71,801.6435523,1191.093478,64.85720759,no
52193,520,52193-520,42-4,6,150,,NA,2.5,0.04061,,7/13/2019,2019,7,13,42,41.23130333,-124.9554167,1702.71,1902,1702.71,801.6435523,1191.093478,64.85720759,no
52193,521,52193-521,42-4,7,100,,NA,2.5,0.26577,,7/13/2019,2019,7,13,42,41.23130333,-124.9554167,1702.71,1902,1702.71,801.6435523,1191.093478,64.85720759,no
52193,522,52193-522,42-4,8,100,,NA,2.5,0.26577,,7/13/2019,2019,7,13,42,41.23130333,-124.9554167,1702.71,1902,1702.71,801.6435523,1191.093478,64.85720759,no
52193,523,52193-523,42-4,9,50,,NA,2.5,0.4614,,7/13/2019,2019,7,13,42,41.23130333,-124.9554167,1702.71,1902,1702.71,801.6435523,1191.093478,64.85720759,no
52193,524,52193-524,42-4,10,50,,NA,2.5,0.4614,,7/13/2019,2019,7,13,42,41.23130333,-124.9554167,1702.71,1902,1702.71,801.6435523,1191.093478,64.85720759,no
52193,525,52193-525,42-4,sfc,0,,NA,2.5,0.48849,Yes,7/13/2019,2019,7,13,42,41.23130333,-124.9554167,1702.71,1902,1702.71,801.6435523,1191.093478,64.85720759,no
52193,526,52193-526,42-4,sfc,0,,NA,2.5,0.48849,Yes,7/13/2019,2019,7,13,42,41.23130333,-124.9554167,1702.71,1902,1702.71,801.6435523,1191.093478,64.85720759,no
52193,527,52193-527,42-3,1,500,,NA,2.5,0.00719,,7/13/2019,2019,7,13,42,41.22989333,-124.8432383,1144.52,1187,1144.52,811.0840629,1190.730826,55.45310815,no
52193,528,52193-528,42-3,2,500,,NA,2.5,0.00719,,7/13/2019,2019,7,13,42,41.22989333,-124.8432383,1144.52,1187,1144.52,811.0840629,1190.730826,55.45310815,no
52193,529,52193-529,42-3,3,300,,NA,2.5,0.0049,,7/13/2019,2019,7,13,42,41.22989333,-124.8432383,1144.52,1187,1144.52,811.0840629,1190.730826,55.45310815,no
52193,530,52193-530,42-3,4,300,,NA,2.5,0.0049,,7/13/2019,2019,7,13,42,41.22989333,-124.8432383,1144.52,1187,1144.52,811.0840629,1190.730826,55.45310815,no
52193,531,52193-531,42-3,5,150,,NA,2.5,-0.0047,,7/13/2019,2019,7,13,42,41.22989333,-124.8432383,1144.52,1187,1144.52,811.0840629,1190.730826,55.45310815,no
52193,532,52193-532,42-3,6,150,,NA,2.5,-0.0047,,7/13/2019,2019,7,13,42,41.22989333,-124.8432383,1144.52,1187,1144.52,811.0840629,1190.730826,55.45310815,no
52193,533,52193-533,42-3,7,100,,NA,2.5,0.08172,,7/13/2019,2019,7,13,42,41.22989333,-124.8432383,1144.52,1187,1144.52,811.0840629,1190.730826,55.45310815,no
52193,534,52193-534,42-3,8,100,,NA,2.5,0.08172,,7/13/2019,2019,7,13,42,41.22989333,-124.8432383,1144.52,1187,1144.52,811.0840629,1190.730826,55.45310815,no
52193,535,52193-535,42-3,9,50,,NA,2.5,1.01438,Yes,7/13/2019,2019,7,13,42,41.22989333,-124.8432383,1144.52,1187,1144.52,811.0840629,1190.730826,55.45310815,no
52193,536,52193-536,42-3,10,50,,NA,2.5,1.01438,,7/13/2019,2019,7,13,42,41.22989333,-124.8432383,1144.52,1187,1144.52,811.0840629,1190.730826,55.45310815,no
52193,537,52193-537,42-3,sfc,0,,NA,2.5,0.73211,Yes,7/13/2019,2019,7,13,42,41.22989333,-124.8432383,1144.52,1187,1144.52,811.0840629,1190.730826,55.45310815,no
52193,538,52193-538,42-3,sfc,0,,NA,2.5,0.73211,Yes,7/13/2019,2019,7,13,42,41.22989333,-124.8432383,1144.52,1187,1144.52,811.0840629,1190.730826,55.45310815,no
52193,539,52193-539,42-2,1,500,,NA,2.5,0.00808,,7/13/2019,2019,7,13,42,41.23201167,-124.5093483,848.7,807,848.7,839.2020027,1190.409173,27.45883455,no
52193,540,52193-540,42-2,2,500,,NA,2.5,0.00808,,7/13/2019,2019,7,13,42,41.23201167,-124.5093483,848.7,807,848.7,839.2020027,1190.409173,27.45883455,no
52193,541,52193-541,42-2,3,300,,NA,2.5,0.00298,,7/13/2019,2019,7,13,42,41.23201167,-124.5093483,848.7,807,848.7,839.2020027,1190.409173,27.45883455,no
52193,542,52193-542,42-2,4,300,,NA,2.5,0.00298,,7/13/2019,2019,7,13,42,41.23201167,-124.5093483,848.7,807,848.7,839.2020027,1190.409173,27.45883455,no
52193,543,52193-543,42-2,5,150,,NA,2.5,3.57E-04,,7/13/2019,2019,7,13,42,41.23201167,-124.5093483,848.7,807,848.7,839.2020027,1190.409173,27.45883455,no
52193,544,52193-544,42-2,6,150,,NA,2.5,3.57E-04,,7/13/2019,2019,7,13,42,41.23201167,-124.5093483,848.7,807,848.7,839.2020027,1190.409173,27.45883455,no
52193,545,52193-545,42-2,7,100,,NA,2.5,0.01721,,7/13/2019,2019,7,13,42,41.23201167,-124.5093483,848.7,807,848.7,839.2020027,1190.409173,27.45883455,no
52193,546,52193-546,42-2,8,100,,NA,2.5,0.01721,,7/13/2019,2019,7,13,42,41.23201167,-124.5093483,848.7,807,848.7,839.2020027,1190.409173,27.45883455,no
52193,547,52193-547,42-2,9,50,,NA,2.5,0.11667,,7/13/2019,2019,7,13,42,41.23201167,-124.5093483,848.7,807,848.7,839.2020027,1190.409173,27.45883455,no
52193,548,52193-548,42-2,10,50,,NA,2.5,0.11667,,7/13/2019,2019,7,13,42,41.23201167,-124.5093483,848.7,807,848.7,839.2020027,1190.409173,27.45883455,no
52193,549,52193-549,42-2,sfc,0,,NA,2.5,0.81678,Yes,7/13/2019,2019,7,13,42,41.23201167,-124.5093483,848.7,807,848.7,839.2020027,1190.409173,27.45883455,no
52193,550,52193-550,42-2,sfc,0,,NA,2.5,0.81678,Yes,7/13/2019,2019,7,13,42,41.23201167,-124.5093483,848.7,807,848.7,839.2020027,1190.409173,27.45883455,no
52193,551,52193-551,42-1,1,44,,NA,2.5,1.57218,Yes,7/13/2019,2019,7,13,42,41.23093583,-124.1784033,48.94,51,48.94,867.0669029,1189.827545,0.294316556,no
52193,552,52193-552,42-1,2,44,,NA,2.5,1.57218,Yes,7/13/2019,2019,7,13,42,41.23093583,-124.1784033,48.94,51,48.94,867.0669029,1189.827545,0.294316556,no
52193,553,52193-553,42-1,3,25,,NA,2.5,6.04081,Yes,7/13/2019,2019,7,13,42,41.23093583,-124.1784033,48.94,51,48.94,867.0669029,1189.827545,0.294316556,no
52193,554,52193-554,42-1,4,25,,NA,2.5,6.04081,Yes,7/13/2019,2019,7,13,42,41.23093583,-124.1784033,48.94,51,48.94,867.0669029,1189.827545,0.294316556,no
52193,555,52193-555,42-1,sfc,0,,NA,2.5,0.25681,Yes,7/13/2019,2019,7,13,42,41.23093583,-124.1784033,48.94,51,48.94,867.0669029,1189.827545,0.294316556,no
52193,556,52193-556,42-1,sfc,0,,NA,2.5,0.25681,Yes,7/13/2019,2019,7,13,42,41.23093583,-124.1784033,48.94,51,48.94,867.0669029,1189.827545,0.294316556,no
52193,558,52193-558,43-8,1,500,,NA,2.5,0.00782,,7/14/2019,2019,7,14,43,41.393765,-124.9871533,1514.57,1606,1514.57,799.4427498,1209.110405,68.76498063,no
52193,559,52193-559,43-8,2,500,,NA,2.5,0.00782,,7/14/2019,2019,7,14,43,41.393765,-124.9871533,1514.57,1606,1514.57,799.4427498,1209.110405,68.76498063,no
52193,560,52193-560,43-8,3,300,,NA,2.5,0.00124,,7/14/2019,2019,7,14,43,41.393765,-124.9871533,1514.57,1606,1514.57,799.4427498,1209.110405,68.76498063,no
52193,561,52193-561,43-8,4,300,,NA,2.5,0.00124,,7/14/2019,2019,7,14,43,41.393765,-124.9871533,1514.57,1606,1514.57,799.4427498,1209.110405,68.76498063,no
52193,562,52193-562,43-8,5,150,,NA,2.5,-0.000664,,7/14/2019,2019,7,14,43,41.393765,-124.9871533,1514.57,1606,1514.57,799.4427498,1209.110405,68.76498063,no
52193,563,52193-563,43-8,6,150,,NA,2.5,-0.000664,,7/14/2019,2019,7,14,43,41.393765,-124.9871533,1514.57,1606,1514.57,799.4427498,1209.110405,68.76498063,no
52193,564,52193-564,43-8,7,100,,NA,2.5,0.0105,,7/14/2019,2019,7,14,43,41.393765,-124.9871533,1514.57,1606,1514.57,799.4427498,1209.110405,68.76498063,no
52193,565,52193-565,43-8,8,100,,NA,2.5,0.0105,,7/14/2019,2019,7,14,43,41.393765,-124.9871533,1514.57,1606,1514.57,799.4427498,1209.110405,68.76498063,no
52193,566,52193-566,43-8,9,50,,NA,2.5,0.37207,,7/14/2019,2019,7,14,43,41.393765,-124.9871533,1514.57,1606,1514.57,799.4427498,1209.110405,68.76498063,no
52193,567,52193-567,43-8,10,50,,NA,2.5,0.37207,,7/14/2019,2019,7,14,43,41.393765,-124.9871533,1514.57,1606,1514.57,799.4427498,1209.110405,68.76498063,no
52193,568,52193-568,43-8,sfc,0,,NA,2.5,0.37534,Yes,7/14/2019,2019,7,14,43,41.393765,-124.9871533,1514.57,1606,1514.57,799.4427498,1209.110405,68.76498063,no
52193,569,52193-569,43-8,sfc,0,,NA,2.5,0.37534,Yes,7/14/2019,2019,7,14,43,41.393765,-124.9871533,1514.57,1606,1514.57,799.4427498,1209.110405,68.76498063,no
52193,570,52193-570,43-6,1,500,,NA,2.5,0.00818,,7/14/2019,2019,7,14,43,41.39631333,-124.7418667,1099.09,1104,1099.09,820.052036,1208.947274,48.2496966,no
52193,571,52193-571,43-6,2,500,,NA,2.5,0.00818,,7/14/2019,2019,7,14,43,41.39631333,-124.7418667,1099.09,1104,1099.09,820.052036,1208.947274,48.2496966,no
52193,572,52193-572,43-6,3,300,,NA,2.5,0.00441,,7/14/2019,2019,7,14,43,41.39631333,-124.7418667,1099.09,1104,1099.09,820.052036,1208.947274,48.2496966,no
52193,573,52193-573,43-6,4,300,,NA,2.5,0.00441,,7/14/2019,2019,7,14,43,41.39631333,-124.7418667,1099.09,1104,1099.09,820.052036,1208.947274,48.2496966,no
52193,574,52193-574,43-6,5,150,,NA,2.5,-0.0048,,7/14/2019,2019,7,14,43,41.39631333,-124.7418667,1099.09,1104,1099.09,820.052036,1208.947274,48.2496966,no
52193,575,52193-575,43-6,6,150,,NA,2.5,-0.0048,,7/14/2019,2019,7,14,43,41.39631333,-124.7418667,1099.09,1104,1099.09,820.052036,1208.947274,48.2496966,no
52193,576,52193-576,43-6,7,100,,NA,2.5,0.02069,,7/14/2019,2019,7,14,43,41.39631333,-124.7418667,1099.09,1104,1099.09,820.052036,1208.947274,48.2496966,no
52193,577,52193-577,43-6,8,100,,NA,2.5,0.02069,,7/14/2019,2019,7,14,43,41.39631333,-124.7418667,1099.09,1104,1099.09,820.052036,1208.947274,48.2496966,no
52193,578,52193-578,43-6,9,50,,NA,2.5,0.13407,,7/14/2019,2019,7,14,43,41.39631333,-124.7418667,1099.09,1104,1099.09,820.052036,1208.947274,48.2496966,no
52193,579,52193-579,43-6,10,50,,NA,2.5,0.13407,,7/14/2019,2019,7,14,43,41.39631333,-124.7418667,1099.09,1104,1099.09,820.052036,1208.947274,48.2496966,no
52193,580,52193-580,43-6,sfc,0,,NA,2.5,0.63134,Yes,7/14/2019,2019,7,14,43,41.39631333,-124.7418667,1099.09,1104,1099.09,820.052036,1208.947274,48.2496966,no
52193,581,52193-581,43-6,sfc,0,,NA,2.5,0.63134,Yes,7/14/2019,2019,7,14,43,41.39631333,-124.7418667,1099.09,1104,1099.09,820.052036,1208.947274,48.2496966,no
52193,582,52193-582,43-5,1,500,,NA,2.5,0.00415,,7/14/2019,2019,7,14,43,41.39870667,-124.6264717,1052.8,1030,1052.8,829.7506768,1209.019219,38.59848028,no
52193,583,52193-583,43-5,2,500,,NA,2.5,0.00415,,7/14/2019,2019,7,14,43,41.39870667,-124.6264717,1052.8,1030,1052.8,829.7506768,1209.019219,38.59848028,no
52193,584,52193-584,43-5,3,300,,NA,2.5,-4.56E-04,,7/14/2019,2019,7,14,43,41.39870667,-124.6264717,1052.8,1030,1052.8,829.7506768,1209.019219,38.59848028,no
52193,585,52193-585,43-5,4,300,,NA,2.5,-4.56E-04,,7/14/2019,2019,7,14,43,41.39870667,-124.6264717,1052.8,1030,1052.8,829.7506768,1209.019219,38.59848028,no
52193,586,52193-586,43-5,5,150,,NA,2.5,0.01363,,7/14/2019,2019,7,14,43,41.39870667,-124.6264717,1052.8,1030,1052.8,829.7506768,1209.019219,38.59848028,no
52193,587,52193-587,43-5,6,150,,NA,2.5,0.01363,,7/14/2019,2019,7,14,43,41.39870667,-124.6264717,1052.8,1030,1052.8,829.7506768,1209.019219,38.59848028,no
52193,588,52193-588,43-5,7,100,,NA,2.5,0.02096,,7/14/2019,2019,7,14,43,41.39870667,-124.6264717,1052.8,1030,1052.8,829.7506768,1209.019219,38.59848028,no
52193,589,52193-589,43-5,8,100,,NA,2.5,0.02096,,7/14/2019,2019,7,14,43,41.39870667,-124.6264717,1052.8,1030,1052.8,829.7506768,1209.019219,38.59848028,no
52193,590,52193-590,43-5,9,50,,NA,2.5,0.44029,,7/14/2019,2019,7,14,43,41.39870667,-124.6264717,1052.8,1030,1052.8,829.7506768,1209.019219,38.59848028,no
52193,591,52193-591,43-5,10,50,,NA,2.5,0.44029,,7/14/2019,2019,7,14,43,41.39870667,-124.6264717,1052.8,1030,1052.8,829.7506768,1209.019219,38.59848028,no
52193,592,52193-592,43-5,sfc,0,,NA,2.5,0.67594,Yes,7/14/2019,2019,7,14,43,41.39870667,-124.6264717,1052.8,1030,1052.8,829.7506768,1209.019219,38.59848028,no
52193,593,52193-593,43-5,sfc,0,,NA,2.5,0.67594,Yes,7/14/2019,2019,7,14,43,41.39870667,-124.6264717,1052.8,1030,1052.8,829.7506768,1209.019219,38.59848028,no
52193,594,52193-594,43-4,1,442,,NA,2.5,0.00685,,7/14/2019,2019,7,14,43,41.39164333,-124.5129967,456.61,365,456.61,839.265722,1208.059546,29.11903369,no
52193,595,52193-595,43-4,2,442,,NA,2.5,0.00685,,7/14/2019,2019,7,14,43,41.39164333,-124.5129967,456.61,365,456.61,839.265722,1208.059546,29.11903369,no
52193,596,52193-596,43-4,3,300,,NA,2.5,0.00273,,7/14/2019,2019,7,14,43,41.39164333,-124.5129967,456.61,365,456.61,839.265722,1208.059546,29.11903369,no
52193,597,52193-597,43-4,4,300,,NA,2.5,0.00273,,7/14/2019,2019,7,14,43,41.39164333,-124.5129967,456.61,365,456.61,839.265722,1208.059546,29.11903369,no
52193,598,52193-598,43-4,5,150,,NA,2.5,-0.0096,,7/14/2019,2019,7,14,43,41.39164333,-124.5129967,456.61,365,456.61,839.265722,1208.059546,29.11903369,no
52193,599,52193-599,43-4,6,150,,NA,2.5,-0.0096,,7/14/2019,2019,7,14,43,41.39164333,-124.5129967,456.61,365,456.61,839.265722,1208.059546,29.11903369,no
52193,600,52193-600,43-4,7,100,,NA,2.5,-0.0025,,7/14/2019,2019,7,14,43,41.39164333,-124.5129967,456.61,365,456.61,839.265722,1208.059546,29.11903369,no
52193,601,52193-601,43-4,8,100,,NA,2.5,-0.0025,,7/14/2019,2019,7,14,43,41.39164333,-124.5129967,456.61,365,456.61,839.265722,1208.059546,29.11903369,no
52193,602,52193-602,43-4,9,50,,NA,2.5,0.09282,,7/14/2019,2019,7,14,43,41.39164333,-124.5129967,456.61,365,456.61,839.265722,1208.059546,29.11903369,no
52193,603,52193-603,43-4,10,50,,NA,2.5,0.09282,,7/14/2019,2019,7,14,43,41.39164333,-124.5129967,456.61,365,456.61,839.265722,1208.059546,29.11903369,no
52193,604,52193-604,43-4,sfc,0,,NA,2.5,0.63622,Yes,7/14/2019,2019,7,14,43,41.39164333,-124.5129967,456.61,365,456.61,839.265722,1208.059546,29.11903369,no
52193,605,52193-605,43-4,sfc,0,,NA,2.5,0.63622,Yes,7/14/2019,2019,7,14,43,41.39164333,-124.5129967,456.61,365,456.61,839.265722,1208.059546,29.11903369,no
52193,606,52193-606,43-2,1,135,,NA,2.5,0.01461,,7/14/2019,2019,7,14,43,41.39645833,-124.4356367,143.42,171,143.42,845.7752773,1208.475634,22.6405931,no
52193,607,52193-607,43-2,2,135,,NA,2.5,0.01461,,7/14/2019,2019,7,14,43,41.39645833,-124.4356367,143.42,171,143.42,845.7752773,1208.475634,22.6405931,no
52193,608,52193-608,43-2,3,100,,NA,2.5,-0.0091,,7/14/2019,2019,7,14,43,41.39645833,-124.4356367,143.42,171,143.42,845.7752773,1208.475634,22.6405931,no
52193,609,52193-609,43-2,4,100,,NA,2.5,-0.0091,,7/14/2019,2019,7,14,43,41.39645833,-124.4356367,143.42,171,143.42,845.7752773,1208.475634,22.6405931,no
52193,610,52193-610,43-2,5,50,,NA,2.5,0.02172,,7/14/2019,2019,7,14,43,41.39645833,-124.4356367,143.42,171,143.42,845.7752773,1208.475634,22.6405931,no
52193,611,52193-611,43-2,6,50,,NA,2.5,0.02172,,7/14/2019,2019,7,14,43,41.39645833,-124.4356367,143.42,171,143.42,845.7752773,1208.475634,22.6405931,no
52193,612,52193-612,43-2,sfc,0,,NA,2.5,0.5934,Yes,7/14/2019,2019,7,14,43,41.39645833,-124.4356367,143.42,171,143.42,845.7752773,1208.475634,22.6405931,no
52193,613,52193-613,43-2,sfc,0,,NA,2.5,0.5934,,7/14/2019,2019,7,14,43,41.39645833,-124.4356367,143.42,171,143.42,845.7752773,1208.475634,22.6405931,no
52193,617,52193-617,47-9,1,500,,NA,2.5,0.00806,,7/21/2019,2019,7,21,47,42.06771833,-125.1642983,-0.02,2016,2016,786.6793177,1283.928869,65.61860206,no
52193,618,52193-618,47-9,2,500,,NA,2.5,0.00806,,7/21/2019,2019,7,21,47,42.06771833,-125.1642983,-0.02,2016,2016,786.6793177,1283.928869,65.61860206,no
52193,619,52193-619,47-9,3,300,,NA,2.5,0.0013,,7/21/2019,2019,7,21,47,42.06771833,-125.1642983,-0.02,2016,2016,786.6793177,1283.928869,65.61860206,no
52193,620,52193-620,47-9,4,300,,NA,2.5,0.0013,,7/21/2019,2019,7,21,47,42.06771833,-125.1642983,-0.02,2016,2016,786.6793177,1283.928869,65.61860206,no
52193,621,52193-621,47-9,5,150,,NA,2.5,0.00866,,7/21/2019,2019,7,21,47,42.06771833,-125.1642983,-0.02,2016,2016,786.6793177,1283.928869,65.61860206,no
52193,622,52193-622,47-9,6,150,,NA,2.5,0.00866,,7/21/2019,2019,7,21,47,42.06771833,-125.1642983,-0.02,2016,2016,786.6793177,1283.928869,65.61860206,no
52193,623,52193-623,47-9,7,100,,NA,2.5,0.0056,,7/21/2019,2019,7,21,47,42.06771833,-125.1642983,-0.02,2016,2016,786.6793177,1283.928869,65.61860206,no
52193,624,52193-624,47-9,8,100,,NA,2.5,0.0056,,7/21/2019,2019,7,21,47,42.06771833,-125.1642983,-0.02,2016,2016,786.6793177,1283.928869,65.61860206,no
52193,625,52193-625,47-9,9,50,,NA,2.5,0.23391,,7/21/2019,2019,7,21,47,42.06771833,-125.1642983,-0.02,2016,2016,786.6793177,1283.928869,65.61860206,no
52193,626,52193-626,47-9,10,50,,NA,2.5,0.23391,,7/21/2019,2019,7,21,47,42.06771833,-125.1642983,-0.02,2016,2016,786.6793177,1283.928869,65.61860206,no
52193,627,52193-627,47-9,sfc,0,,NA,2.5,3.45541,Yes,7/21/2019,2019,7,21,47,42.06771833,-125.1642983,-0.02,2016,2016,786.6793177,1283.928869,65.61860206,no
52193,628,52193-628,47-9,sfc,0,,NA,2.5,3.45541,Yes,7/21/2019,2019,7,21,47,42.06771833,-125.1642983,-0.02,2016,2016,786.6793177,1283.928869,65.61860206,no
52193,629,52193-629,47-7,1,500,,NA,2.5,0.00207,,7/21/2019,2019,7,21,47,42.06740167,-125.00537,1190.295,1222,1190.295,799.8953,1283.579296,52.46516179,no
52193,630,52193-630,47-7,2,500,,NA,2.5,0.00207,,7/21/2019,2019,7,21,47,42.06740167,-125.00537,1190.295,1222,1190.295,799.8953,1283.579296,52.46516179,no
52193,631,52193-631,47-7,3,300,,NA,2.5,-0.0053,,7/21/2019,2019,7,21,47,42.06740167,-125.00537,1190.295,1222,1190.295,799.8953,1283.579296,52.46516179,no
52193,632,52193-632,47-7,4,300,,NA,2.5,-0.0053,,7/21/2019,2019,7,21,47,42.06740167,-125.00537,1190.295,1222,1190.295,799.8953,1283.579296,52.46516179,no
52193,633,52193-633,47-7,5,150,,NA,2.5,-0.0044,,7/21/2019,2019,7,21,47,42.06740167,-125.00537,1190.295,1222,1190.295,799.8953,1283.579296,52.46516179,no
52193,634,52193-634,47-7,6,150,,NA,2.5,-0.0044,,7/21/2019,2019,7,21,47,42.06740167,-125.00537,1190.295,1222,1190.295,799.8953,1283.579296,52.46516179,no
52193,635,52193-635,47-7,7,100,,NA,2.5,0.00517,,7/21/2019,2019,7,21,47,42.06740167,-125.00537,1190.295,1222,1190.295,799.8953,1283.579296,52.46516179,no
52193,636,52193-636,47-7,8,100,,NA,2.5,0.00517,,7/21/2019,2019,7,21,47,42.06740167,-125.00537,1190.295,1222,1190.295,799.8953,1283.579296,52.46516179,no
52193,637,52193-637,47-7,9,50,,NA,2.5,0.15616,,7/21/2019,2019,7,21,47,42.06740167,-125.00537,1190.295,1222,1190.295,799.8953,1283.579296,52.46516179,no
52193,638,52193-638,47-7,10,50,,NA,2.5,0.15616,,7/21/2019,2019,7,21,47,42.06740167,-125.00537,1190.295,1222,1190.295,799.8953,1283.579296,52.46516179,no
52193,639,52193-639,47-7,sfc,0,,NA,2.5,1.70589,Yes,7/21/2019,2019,7,21,47,42.06740167,-125.00537,1190.295,1222,1190.295,799.8953,1283.579296,52.46516179,no
52193,640,52193-640,47-7,sfc,0,,NA,2.5,1.70589,Yes,7/21/2019,2019,7,21,47,42.06740167,-125.00537,1190.295,1222,1190.295,799.8953,1283.579296,52.46516179,no
52193,641,52193-641,47-5,1,500,,NA,2.5,0.00581,,7/21/2019,2019,7,21,47,42.064585,-124.7708017,637.42,645,637.42,819.3966485,1282.840578,33.05064882,no
52193,642,52193-642,47-5,2,500,,NA,2.5,0.00581,,7/21/2019,2019,7,21,47,42.064585,-124.7708017,637.42,645,637.42,819.3966485,1282.840578,33.05064882,no
52193,643,52193-643,47-5,3,300,,NA,2.5,-0.0024,,7/21/2019,2019,7,21,47,42.064585,-124.7708017,637.42,645,637.42,819.3966485,1282.840578,33.05064882,no
52193,644,52193-644,47-5,4,300,,NA,2.5,-0.0024,,7/21/2019,2019,7,21,47,42.064585,-124.7708017,637.42,645,637.42,819.3966485,1282.840578,33.05064882,no
52193,645,52193-645,47-5,5,150,,NA,2.5,-0.0098,,7/21/2019,2019,7,21,47,42.064585,-124.7708017,637.42,645,637.42,819.3966485,1282.840578,33.05064882,no
52193,646,52193-646,47-5,6,150,,NA,2.5,-0.0098,,7/21/2019,2019,7,21,47,42.064585,-124.7708017,637.42,645,637.42,819.3966485,1282.840578,33.05064882,no
52193,647,52193-647,47-5,7,100,,NA,2.5,0.02069,,7/21/2019,2019,7,21,47,42.064585,-124.7708017,637.42,645,637.42,819.3966485,1282.840578,33.05064882,no
52193,648,52193-648,47-5,8,100,,NA,2.5,0.02069,,7/21/2019,2019,7,21,47,42.064585,-124.7708017,637.42,645,637.42,819.3966485,1282.840578,33.05064882,no
52193,649,52193-649,47-5,9,50,,NA,2.5,1.20836,,7/21/2019,2019,7,21,47,42.064585,-124.7708017,637.42,645,637.42,819.3966485,1282.840578,33.05064882,no
52193,650,52193-650,47-5,10,50,,NA,2.5,1.20836,,7/21/2019,2019,7,21,47,42.064585,-124.7708017,637.42,645,637.42,819.3966485,1282.840578,33.05064882,no
52193,651,52193-651,47-5,sfc,0,,NA,2.5,1.49409,,7/21/2019,2019,7,21,47,42.064585,-124.7708017,637.42,645,637.42,819.3966485,1282.840578,33.05064882,no
52193,652,52193-652,47-5,sfc,0,,NA,2.5,1.49409,,7/21/2019,2019,7,21,47,42.064585,-124.7708017,637.42,645,637.42,819.3966485,1282.840578,33.05064882,no
52193,653,52193-653,47-3,1,268,,NA,2.5,NaN,,7/21/2019,2019,7,21,47,42.06485667,-124.5978567,268.75,386,268.75,833.7826285,1282.583425,18.73658369,no
52193,654,52193-654,47-3,2,268,,NA,2.5,NaN,,7/21/2019,2019,7,21,47,42.06485667,-124.5978567,268.75,386,268.75,833.7826285,1282.583425,18.73658369,no
52193,655,52193-655,47-3,3,150,,NA,2.5,-0.0146,,7/21/2019,2019,7,21,47,42.06485667,-124.5978567,268.75,386,268.75,833.7826285,1282.583425,18.73658369,no
52193,656,52193-656,47-3,4,150,,NA,2.5,-0.0146,,7/21/2019,2019,7,21,47,42.06485667,-124.5978567,268.75,386,268.75,833.7826285,1282.583425,18.73658369,no
52193,657,52193-657,47-3,5,100,,NA,2.5,-0.0025,,7/21/2019,2019,7,21,47,42.06485667,-124.5978567,268.75,386,268.75,833.7826285,1282.583425,18.73658369,no
52193,658,52193-658,47-3,6,100,,NA,2.5,-0.0025,,7/21/2019,2019,7,21,47,42.06485667,-124.5978567,268.75,386,268.75,833.7826285,1282.583425,18.73658369,no
52193,659,52193-659,47-3,7,50,,NA,2.5,1.18377,,7/21/2019,2019,7,21,47,42.06485667,-124.5978567,268.75,386,268.75,833.7826285,1282.583425,18.73658369,no
52193,660,52193-660,47-3,8,50,,NA,2.5,1.18377,,7/21/2019,2019,7,21,47,42.06485667,-124.5978567,268.75,386,268.75,833.7826285,1282.583425,18.73658369,no
52193,661,52193-661,47-3,sfc,0,,NA,2.5,1.54182,,7/21/2019,2019,7,21,47,42.06485667,-124.5978567,268.75,386,268.75,833.7826285,1282.583425,18.73658369,no
52193,662,52193-662,47-3,sfc,0,,NA,2.5,1.54182,,7/21/2019,2019,7,21,47,42.06485667,-124.5978567,268.75,386,268.75,833.7826285,1282.583425,18.73658369,no
52193,663,52193-663,47-2,1,100,,NA,2.5,0.01232,,7/21/2019,2019,7,21,47,42.06466333,-124.5103483,118.76,154,118.76,841.0612607,1282.425842,11.49377648,no
52193,664,52193-664,47-2,2,100,,NA,2.5,0.01232,,7/21/2019,2019,7,21,47,42.06466333,-124.5103483,118.76,154,118.76,841.0612607,1282.425842,11.49377648,no
52193,665,52193-665,47-2,3,50,,NA,2.5,0.58698,,7/21/2019,2019,7,21,47,42.06466333,-124.5103483,118.76,154,118.76,841.0612607,1282.425842,11.49377648,no
52193,666,52193-666,47-2,4,50,,NA,2.5,0.58698,,7/21/2019,2019,7,21,47,42.06466333,-124.5103483,118.76,154,118.76,841.0612607,1282.425842,11.49377648,no
52193,667,52193-667,47-2,sfc,0,,NA,2.5,1.12797,,7/21/2019,2019,7,21,47,42.06466333,-124.5103483,118.76,154,118.76,841.0612607,1282.425842,11.49377648,no
52193,668,52193-668,47-2,sfc,0,,NA,2.5,1.12797,,7/21/2019,2019,7,21,47,42.06466333,-124.5103483,118.76,154,118.76,841.0612607,1282.425842,11.49377648,no
52193,669,52193-669,47-1,1,43,,NA,2.5,0.21004,,7/21/2019,2019,7,21,47,42.06483,-124.3726533,52.91,59,52.91,852.5157353,1282.242257,0.121827459,no
52193,670,52193-670,47-1,2,43,,NA,2.5,0.21004,,7/21/2019,2019,7,21,47,42.06483,-124.3726533,52.91,59,52.91,852.5157353,1282.242257,0.121827459,no
52193,671,52193-671,47-1,3,25,,NA,2.5,0.32085,,7/21/2019,2019,7,21,47,42.06483,-124.3726533,52.91,59,52.91,852.5157353,1282.242257,0.121827459,no
52193,672,52193-672,47-1,4,25,,NA,2.5,0.32085,,7/21/2019,2019,7,21,47,42.06483,-124.3726533,52.91,59,52.91,852.5157353,1282.242257,0.121827459,no
52193,673,52193-673,47-1,sfc,0,,NA,2.5,0.52485,,7/21/2019,2019,7,21,47,42.06483,-124.3726533,52.91,59,52.91,852.5157353,1282.242257,0.121827459,no
52193,674,52193-674,47-1,sfc,0,,NA,2.5,0.52485,,7/21/2019,2019,7,21,47,42.06483,-124.3726533,52.91,59,52.91,852.5157353,1282.242257,0.121827459,no
52193,676,52193-676,49-2,1,150,,NA,2.5,0.00374,,7/22/2019,2019,7,22,49,42.39589167,-124.7121883,178.17,223,178.17,825.1356156,1319.336623,18.11972992,no
52193,677,52193-677,49-2,2,150,,NA,2.5,0.00374,,7/22/2019,2019,7,22,49,42.39589167,-124.7121883,178.17,223,178.17,825.1356156,1319.336623,18.11972992,no
52193,678,52193-678,49-2,3,100,,NA,2.5,0.0061,,7/22/2019,2019,7,22,49,42.39589167,-124.7121883,178.17,223,178.17,825.1356156,1319.336623,18.11972992,no
52193,679,52193-679,49-2,4,100,,NA,2.5,0.0061,,7/22/2019,2019,7,22,49,42.39589167,-124.7121883,178.17,223,178.17,825.1356156,1319.336623,18.11972992,no
52193,680,52193-680,49-2,5,50,,NA,2.5,0.53742,,7/22/2019,2019,7,22,49,42.39589167,-124.7121883,178.17,223,178.17,825.1356156,1319.336623,18.11972992,no
52193,681,52193-681,49-2,6,50,,NA,2.5,0.53742,,7/22/2019,2019,7,22,49,42.39589167,-124.7121883,178.17,223,178.17,825.1356156,1319.336623,18.11972992,no
52193,682,52193-682,49-2,sfc,0,,NA,2.5,1.03146,Yes,7/22/2019,2019,7,22,49,42.39589167,-124.7121883,178.17,223,178.17,825.1356156,1319.336623,18.11972992,no
